author,category,country,description,domain,fetched_at,language,published_at,social_image,source_name,source_system,title,url
Sahar Chmais,broad_news,Other,Lammes Candies is closing its doors after operating in Austin under the same family for 141 years.,Unknown,2026-04-28T05:34:58.657034+00:00,en,2026-04-26 15:59:00,https://media.bizj.us/view/img/13186071/lammescandies20268107*1200xx4032-2265-0-0.jpg,Triangle Business Journal,NewsAPI,"After 141 years, Lammes Candies is closing shop - The Business Journals",https://www.bizjournals.com/austin/news/2026/04/26/lammes-candies-closing-austin-after-141-years.html
Robert DeFelice,broad_news,Other,"To paraphrase Bruce Buffer, it's almost time to step back into the virtual octagon for the next EA Sports UFC game.",Unknown,2026-04-28T05:34:58.657034+00:00,en,2026-04-26 15:52:46,https://insider-gaming.com/wp-content/uploads/2023/09/UFC5FighterHands.png,Insider-gaming.com,NewsAPI,EA Sports UFC 6 Planned For June Release - Insider Gaming,https://insider-gaming.com/ea-sports-ufc-6-planned-for-june-release/
Lydia Amazouz,broad_news,Russia,"Russia launches a crucial 3-ton cargo mission to the ISS, ensuring astronauts remain supplied and operations continue uninterrupted.",Unknown,2026-04-28T05:34:58.657034+00:00,en,2026-04-26 15:45:00,https://dailygalaxy.com/wp-content/uploads/2026/04/Russia-Sends-3-Tons-Of-Supplies-To-The-ISS-In-High-Stakes-Orbital-Resupply-Mission-scaled.png,The Daily Galaxy --Great Discoveries Channel,NewsAPI,Russia Sends 3 Tons Of Supplies To The ISS In High-Stakes Orbital Resupply Mission - The Daily Galaxy,https://dailygalaxy.com/2026/04/russia-sends-3-tons-of-supplies-to-the-iss/
Joey Klender,broad_news,Other,"In the past, Tesla has used Free Supercharging to incentivize the purchase of its expensive vehicles, like the Model S and Model X. However, those vehicles are leaving the company lineup, and Tesla saw a benefit from applying the incentive to another car.",Unknown,2026-04-28T05:34:58.657034+00:00,en,2026-04-26 15:31:27,https://www.teslarati.com/wp-content/uploads/2024/12/tesla-model-3-cybertruck-v4-supercharger-charging-1000x600.jpg,Teslarati,NewsAPI,Tesla offers awesome Free Supercharging incentive on an unexpected vehicle - Teslarati,https://www.teslarati.com/tesla-offers-awesome-free-supercharging-incentive-unexpected-vehicle/
Tay Garcia,broad_news,Other,"From epic sequels to massive new IPs, these are the 10 most anticipated RPGs of 2026.",Unknown,2026-04-28T05:34:58.657034+00:00,en,2026-04-26 15:31:13,https://static0.dualshockersimages.com/wordpress/wp-content/uploads/2026/04/most-anticipated-rpgs-coming-in-2026-prove-the-genre-has-never-been-stronger.jpg?w=1600&h=900&fit=crop,DualShockers,NewsAPI,10 Most Anticipated RPGs That Prove the Genre Has Never Been Stronger - DualShockers,https://www.dualshockers.com/most-anticipated-rpgs-that-prove-the-genre-has-never-been-stronger/
Chrysa Liangou,broad_news,Other,"Small-scale solar systems designed for balconies are beginning to appear in Greece, offering households a low-cost way to reduce electricity bills.",Unknown,2026-04-28T05:34:58.657034+00:00,en,2026-04-26 15:28:23,https://www.ekathimerini.com/wp-content/uploads/2026/04/solar_panels_balcony_shutterstock-960x600.jpg,www.ekathimerini.com,NewsAPI,Balcony solar panels gain ground - eKathimerini.com,https://www.ekathimerini.com/economy/energy/1301901/balcony-solar-panels-gain-ground/
Lewis Parker,broad_news,Other,"The long-serving Square Enix localizer and lyricist revealed that the Final Fantasy maker's CEO ""has been keen on incorporating AI tools into our daily work""",Unknown,2026-04-28T05:34:58.657034+00:00,en,2026-04-26 15:23:20,https://kotaku.com/app/uploads/2026/04/Final-Fantasy-XIV-Fan-Festival-2026-Livestream-image-Square-Enix-e1777216814148-1200x675.jpg,Kotaku,NewsAPI,Final Fantasy 14 Localizer Draws Criticism For AI Art At Fan Fest - Kotaku,https://kotaku.com/ff14-fanfest-panel-koji-fox-ai-art-square-enix-2000690711
Ivan Mehta,broad_news,Other,This $129 device uses MagSafe to stick on the back of an iPhone to power transcription across apps,Unknown,2026-04-28T05:34:58.657034+00:00,en,2026-04-26 15:00:00,"https://techcrunch.com/wp-content/uploads/2026/04/SpeakOn-feat.jpg?resize=1200,675",TechCrunch,NewsAPI,SpeakOn’s dictation device is a good idea marred by platform limitations - TechCrunch,https://techcrunch.com/2026/04/26/speakons-dictation-device-is-a-good-idea-marred-by-platform-limitations/
Unknown,broad_news,Other,"How the body efficiently shifts metabolism after fasting may be key to improving health, UTSW-led research suggests.",Unknown,2026-04-28T05:34:58.657034+00:00,en,2026-04-26 14:55:08,https://scitechdaily.com/images/Intermittent-Fasting-Meal-Planning-Concept.jpg,SciTechDaily,NewsAPI,Scientists Discover a Surprising Reason Intermittent Fasting Extends Life - SciTechDaily,https://scitechdaily.com/scientists-discover-a-surprising-reason-intermittent-fasting-extends-life/
Unknown,broad_news,Other,"Ahead of the Linux 7.1-rc1 kernel release due out later today for closing the Linux 7.1 merge window, I was curious if all the code removals would lead to a negative change in line count over Linux 7.0",Unknown,2026-04-28T05:34:58.657034+00:00,en,2026-04-26 14:48:00,https://www.phoronix.net/image.php?id=2026&image=linux_size_71,Phoronix,NewsAPI,"The Linux Kernel Tree About To Hit 40 Million Lines, AMD Driver Above 6 Million Lines - Phoronix",https://www.phoronix.com/news/Linux-Kernel-Nearly-40M
FOX 35 Digital Staff,broad_news,Other,"2 Florida teens arrested after Target social media prank, officials",Unknown,2026-04-28T05:34:58.657034+00:00,en,2026-04-26 14:47:05,https://images.foxtv.com/static.fox35orlando.com/www.fox35orlando.com/content/uploads/2026/04/1200/630/target-lawnmower-incident-suspects.png?ve=1&tl=1,FOX 35 Orlando,NewsAPI,"2 Florida teens arrested after riding lawnmower through Target, officials - FOX 35 Orlando",https://www.fox35orlando.com/news/2-florida-teens-arrested-after-riding-lawnmower-through-target-officials
Alvin Wanjala,broad_news,Other,"Cheaper Android alternatives to the Apple Watch include the Galaxy Watch 8, Pixel Watch 4, Fitbit Sense 2, OnePlus Watch 2R, and CMF Watch 3 Pro.",Unknown,2026-04-28T05:34:58.657034+00:00,en,2026-04-26 14:47:00,https://www.bgr.com/img/gallery/5-cheaper-android-smartwatch-alternatives-to-the-apple-watch-in-2026/l-intro-1776703803.jpg,BGR,NewsAPI,5 Cheaper Android Smartwatch Alternatives To The Apple Watch In 2026 - bgr.com,https://www.bgr.com/2152646/cheaper-android-smartwatch-alternatives-apple-watch-2026/
Sickr,broad_news,Other,NateTheHate has spoken a little more about the Star Fox game which he claims is coming to the Nintendo Switch 2 this June. While Nate said that Nintendo is planning to announce it this month…,Unknown,2026-04-28T05:34:58.657034+00:00,en,2026-04-26 14:46:57,https://i0.wp.com/mynintendonews.com/wp-content/uploads/2026/04/fox_mccloud.webp?fit=1200%2C750&ssl=1,My Nintendo News,NewsAPI,NateTheHate has “zero doubt” about the new Star Fox project announcement - My Nintendo News,https://mynintendonews.com/2026/04/26/natethehate-has-zero-doubt-about-the-new-star-fox-project-announcement/
Charley Blaine,broad_news,Iran,Here's how Iran war affects us all.,Unknown,2026-04-28T05:34:58.657034+00:00,en,2026-04-26 14:33:00,https://www.thestreet.com/.image/NDA6MDAwMDAwMDAyOTUzMTU0/untitled.jpg?io=1&profile=share16-9,TheStreet,NewsAPI,"GasBuddy flags worrisome gas price trend, sends message on what’s next - thestreet.com",https://www.thestreet.com/automotive/think-gas-is-expensive-heres-where-prices-could-go-this-summer
Unknown,broad_news,Other,"The following is the transcript of the interview with Chevron CEO Mike Wirth that aired on ""Face the Nation with Margaret Brennan"" on April 26, 2026.",Unknown,2026-04-28T05:34:58.657034+00:00,en,2026-04-26 14:32:00,https://assets2.cbsnewsstatic.com/hub/i/r/2026/04/26/6b58e1a2-1a26-4159-8d0c-8bf6f93981a3/thumbnail/1200x630/0367cd8fe163b5e66b4088a53ac02bfe/screenshot-2026-04-26-at-10-31-14-am.png,CBS News,NewsAPI,"Transcript: Chevron CEO Mike Wirth on ""Face the Nation with Margaret Brennan,"" April 26, 2026 - CBS News",https://www.cbsnews.com/news/mike-wirth-chevron-ceo-face-the-nation-transcript-04-26-2026/
Phil Hilton,broad_news,Other,"Trying to fit a workout into your evening routine, but unsure how it will affect your sleep? Here's the lowdown on exercise before bed.",Unknown,2026-04-28T05:34:58.657034+00:00,en,2026-04-26 14:14:35,"https://media.gq.com/photos/686d748790a37f7b66493308/16:9/w_1280,c_limit/Exercise%20Before%20Bed.jpg",GQ Magazine,NewsAPI,The Best Time to Exercise Before Bed - GQ,https://www.gq.com/story/best-time-to-exercise-before-bed-3
Olivier Acuna,broad_news,Other,"Some bitcoin advocates argue freezing dormant coins would set a dangerous precedent, while others say failing to act could pose greater risks.",Unknown,2026-04-28T05:34:58.657034+00:00,en,2026-04-26 14:03:31,https://cdn.sanity.io/images/s3y3vcno/production/5ac794a198da68fdb1b6a9d4e19c2e947f99454c-1920x1080.jpg?auto=format&w=960&h=540&crop=focalpoint&fit=clip&q=75&fm=jpg,CoinDesk,NewsAPI,"Freezing dormant BTC would trigger worst single day repricing in bitcoin’s history, says maximalist - CoinDesk",https://www.coindesk.com/business/2026/04/26/freezing-5-6-million-dormant-bitcoin-could-trigger-worst-single-day-repricing
The Conversation,broad_news,Other,Injectable peptides are generating a lot of buzz online.,Unknown,2026-04-28T05:34:58.657034+00:00,en,2026-04-26 14:02:20,https://www.sciencealert.com/images/2026/04/syringe-drawing-liquid-from-a-vial-blue-and-purple-background.jpg,ScienceAlert,NewsAPI,The Next Ozempic? This Unapproved Peptide Comes With a Big Catch - ScienceAlert,https://www.sciencealert.com/the-next-ozempic-this-unapproved-peptide-comes-with-a-big-catch
Zack Palm,broad_news,Other,The gadget holds a special place in our hearts with its niche problem-solving abilities. These under-$50 gadgets from Lowe's offer surprising utility.,Unknown,2026-04-28T05:34:58.657034+00:00,en,2026-04-26 14:02:00,https://www.bgr.com/img/gallery/lowes-gadgets-under-50-dollars-users-say-worth-buying/l-intro-1777047625.jpg,BGR,NewsAPI,10 Lowe's Gadgets Under $50 Users Say Are Worth Buying - bgr.com,https://www.bgr.com/2152226/lowes-gadgets-under-50-dollars-users-say-worth-buying/
Mark Gurman,broad_news,Other,Also: John Ternus talks AI and services with employees.,Unknown,2026-04-28T05:34:58.657034+00:00,en,2026-04-26 14:00:01,https://assets.bwbx.io/images/users/iqjWHBFdfxIU/iyesLe.Ky1rk/v0/1200x800.jpg,Bloomberg,NewsAPI,Apple’s Cook Gives Ternus a Pipeline of 10 Major New Product Categories - Bloomberg.com,https://www.bloomberg.com/news/newsletters/2026-04-26/new-apple-ceo-john-ternus-first-major-product-is-the-foldable-iphone-road-map-mofu521p
Lottë Reford,broad_news,Other,"McDonald's will be implementing several changes to its restaurants in 2026, including these five big sectors which will see new products and tightening belts.",Unknown,2026-04-28T05:34:58.657034+00:00,en,2026-04-26 14:00:00,https://www.thetakeout.com/img/gallery/5-big-changes-coming-to-mcdonalds-in-2026/l-intro-1776874897.jpg,The Takeout,NewsAPI,5 Big Changes Coming To McDonald's In 2026 - The Takeout,https://www.thetakeout.com/2154858/ig-new-changes-coming-to-mcdonalds-2026/
Kevin Okemwa,broad_news,Other,Many users are adopting custom ISO tools to help them take on Windows 11’s bloatware head‑on.,Unknown,2026-04-28T05:34:58.657034+00:00,en,2026-04-26 14:00:00,https://cdn.mos.cms.futurecdn.net/cDhfmFQCdaQR9njmDAm8hN-2560-80.jpg,Windows Central,NewsAPI,"Windows 11 users are taking it upon themselves to debloat the OS, because Microsoft isn't trying hard enough - Windows Central",https://www.windowscentral.com/microsoft/windows-11/should-you-debloat-windows-11-the-custom-iso-scene-is-bigger-than-you-think
"David Marino, Christian Dass",broad_news,Other,"As stocks hit record after record, some investors are taking to heart the saying: Hedge when you can, not when you must.",Unknown,2026-04-28T05:34:58.657034+00:00,en,2026-04-26 14:00:00,https://assets.bwbx.io/images/users/iqjWHBFdfxIU/iFfRWi.QcMxw/v0/1200x800.jpg,Bloomberg,NewsAPI,Investors Protecting Stocks at Record Eye Bets on Higher Rates - Bloomberg.com,https://www.bloomberg.com/news/articles/2026-04-26/investors-protecting-stocks-at-record-eye-bets-on-higher-rates
Mott Capital Management,broad_news,Other,"Kevin Warsh may replace Jay Powell, reshaping Fed policy—dot plot, forward guidance, balance sheet, and inflation gauge. Read the full analysis here.",Unknown,2026-04-28T05:34:58.657034+00:00,en,2026-04-26 13:55:58,https://static.seekingalpha.com/cdn/s3/uploads/getty_images/2267262440/image_2267262440.jpg?io=getty-c-w1536,Seeking Alpha,NewsAPI,A Massive Change Likely Coming To The Fed And Markets May Not Like It - Seeking Alpha,https://seekingalpha.com/article/4894392-massive-change-likely-coming-to-fed-markets-may-not-like-it
Julie Z. Weil,broad_news,United States,"An advocate called the higher-than-expected numbers “jarring,” and consumer advocates say they signal a surprisingly high rate of extreme financial distress.",Unknown,2026-04-28T05:34:58.657034+00:00,en,2026-04-26 13:32:08,https://www.washingtonpost.com/wp-apps/imrs.php?src=https://arc-anglerfish-washpost-prod-washpost.s3.amazonaws.com/public/IT6QA2WR5IF7T66HMU54EFBXY4_size-normalized.jpg&w=1440,The Washington Post,NewsAPI,"Americans’ electricity was shut off 13 million times in a year, data shows - The Washington Post",https://www.washingtonpost.com/business/2026/04/26/utility-power-electricity-shutoff-bills/
Fred Lambert,broad_news,China,"I just spent two days at the 2026 Beijing Auto Show (Auto China 2026), and I need to tell you...",Unknown,2026-04-28T05:34:58.657034+00:00,en,2026-04-26 13:18:00,https://i0.wp.com/electrek.co/wp-content/uploads/sites/3/2026/04/geely-robotaxi-concept-humanoid-robot_e97daa-e1777209459474.jpg?resize=1200%2C628&quality=82&strip=all&ssl=1,Electrek,NewsAPI,I went to the Beijing Auto Show and it’s a glimpse at the future of the auto industry - Electrek,http://electrek.co/2026/04/26/beijing-auto-show-2026-insane-glimpse-future-auto-industry/
Roland Hutchinson,broad_news,Other,"Discover the Samsung Galaxy Watch Ultra 2. Featuring the new Snapdragon Wear Elite chip, 5G connectivity, and Satellite SOS,",Unknown,2026-04-28T05:34:58.657034+00:00,en,2026-04-26 13:04:54,https://www.geeky-gadgets.com/wp-content/uploads/2026/04/Ultra-2-scaled.jpg,Geeky Gadgets,NewsAPI,"Samsung Galaxy Watch Ultra 2: 5G, Satellite SOS, and the AI upgrade we’ve been waiting forthink - Geeky Gadgets",https://www.geeky-gadgets.com/samsung-galaxy-watch-ultra-2-specs/
"Zoya Teirstein, Grist",broad_news,Other,Warming waters are pushing the dreaded flesh-eating bacteria up the Atlantic coast. Experts explain who's at risk and how worried you really need to be.,Unknown,2026-04-28T05:34:58.657034+00:00,en,2026-04-26 13:00:12,https://gizmodo.com/app/uploads/2026/01/raw-oysters-1200x675.jpg,Gizmodo.com,NewsAPI,A Dangerous Bacteria Is Moving Up the East Coast. Here’s What That Means for You - Gizmodo,https://gizmodo.com/a-dangerous-bacteria-is-moving-up-the-east-coast-heres-what-that-means-for-you-2000750005
Nathan Edwards,broad_news,Other,﻿I regret nothing,Unknown,2026-04-28T05:34:58.657034+00:00,en,2026-04-26 13:00:00,https://platform.theverge.com/wp-content/uploads/sites/2/2026/04/teachmanfish.png?quality=90&strip=all&crop=0%2C10.72080847437%2C100%2C78.55838305126&w=1200,The Verge,NewsAPI,"After three months on Linux, I don’t miss Windows at all - The Verge",https://www.theverge.com/tech/918797/switched-to-linux-dont-miss-windows
Orpheus Joshua,broad_news,Other,"The Hundred Line Last Defense Academy anniversary reveals a stage play, manga adaptation, and new setting materials book.",Unknown,2026-04-28T05:34:58.657034+00:00,en,2026-04-26 12:50:41,https://noisypixel.net/wp-content/uploads/2026/04/hundred-line-last-defense-academy-1.jpg,Noisy Pixel,NewsAPI,"The Hundred Line Last Defense Academy Anniversary Reveals Stage Play, Manga, and Book - Noisy Pixel",https://noisypixel.net/hundred-line-last-defense-academy-anniversary-stage-play-manga/
Bojan Stojkovski,broad_news,China,Chinese researchers have developed a coal-based fuel cell that generates electricity through an electrochemical process rather than combustion.,Unknown,2026-04-28T05:34:58.657034+00:00,en,2026-04-26 12:35:00,https://cms.interestingengineering.com/wp-content/uploads/2026/04/image-1920x1080-2026-04-26T140442.415.png?w=1920,Interesting Engineering,NewsAPI,China’s electrochemical system converts coal into electricity with no direct carbon emission - Interesting Engineering,https://interestingengineering.com/energy/chinas-converts-coal-into-electricity
Mark Jansen,broad_news,Other,Amazon has delved too greedily and too deep,Unknown,2026-04-28T05:34:58.657034+00:00,en,2026-04-26 12:30:10,https://static0.anpoimages.com/wordpress/wp-content/uploads/2026/04/kindle-and-kobo-e-readers-surrounded-by-stacks-of-colorful-physical-books.png?w=1600&h=900&fit=crop,Android Police,NewsAPI,"I left Kindle for a better e-reader a year ago, and I recommend it to everyone - Android Police",https://www.androidpolice.com/i-left-kindle-a-year-ago-and-have-no-regrets/
Brian,broad_news,Other,"The latest Famitsu review scores for the week of April 26, 2026 are as follows: Pragmata – 9/9/10/9 Shinigami Hime to Ishokan no Kaibutsu – 7/8/7/7 Game The Strongest Job Is Apparently Not a Hero or a Sage, but an Appraiser (Provisional) – Dungeon and Mystery…",Unknown,2026-04-28T05:34:58.657034+00:00,en,2026-04-26 12:01:33,https://nintendoeverything.com/wp-content/uploads/Pragmata-Switch-2.jpg,Nintendoeverything.com,NewsAPI,"Famitsu review scores – April 26, 2026 – Pragmata and more - Nintendo Everything",https://nintendoeverything.com/famitsu-review-scores-april-25-2026-pragmata-and-more/
Stephen Edelstein,broad_news,Other,Reap the benefits of someone else's hard work by putting this diesel Defender in your driveway.,Unknown,2026-04-28T05:34:58.657034+00:00,en,2026-04-26 12:00:00,https://www.thedrive.com/wp-content/uploads/2026/04/675490842_1373571104813047_1334921810860567376_n.jpeg?quality=85&w=1200,The Drive,NewsAPI,Spend Your Tax Return on a Backhoe-Engined Land Rover Defender - The Drive,http://www.thedrive.com/news/spend-your-tax-return-on-a-backhoe-engined-land-rover-defender
Eva Roytburg,broad_news,Other,"""You want the most accurate prices. That's pretty clear. The purpose of the market is to inform decisions.""",Unknown,2026-04-28T05:34:58.657034+00:00,en,2026-04-26 12:00:00,"https://fortune.com/img-assets/wp-content/uploads/2026/04/GettyImages-2266472472-e1777086305857.jpg?resize=1200,600",Fortune,NewsAPI,Kalshi and Polymarket want to ban insider trading. But an economist says inside info is the point - Fortune,https://fortune.com/2026/04/26/prediction-markets-insider-trading-illegal-kalshi-polymarket-robin-hanson-economist/
Unknown,broad_news,Other,"Despite mixed reviews, AMD’s most expensive AM5 desktop CPU briefly appeared among Amazon’s top 10 best-selling CPUs AMD's Ryzen 9 9950X3D2 has entered",Unknown,2026-04-28T05:34:58.657034+00:00,en,2026-04-26 11:55:00,https://cdn.videocardz.com/1/2026/04/9950X3D2-HERO-1.jpg,Videocardz.com,NewsAPI,AMD Ryzen 9 9950X3D2 appears in Amazon’s top 10 CPU best sellers - VideoCardz.com,https://videocardz.com/newz/amd-ryzen-9-9950x3d2-appears-in-amazons-top-10-cpu-best-sellers
Madison Mills,broad_news,Other,"When AI labs raise prices, big spending on AI could shift from a flex to a liability.",Unknown,2026-04-28T05:34:58.657034+00:00,en,2026-04-26 11:33:16,https://images.axios.com/xGi5InHs1g6tGzXBN-DfwR1ADqA=/0x0:1920x1080/1366x768/2025/07/02/1751484371498.jpeg,Axios,NewsAPI,AI can cost more than human workers now - Axios,https://www.axios.com/2026/04/26/ai-cost-human-workers
Jonquilyn Hill,broad_news,Other,"﻿How to handle secondhand stress, financial strain, and more.",Unknown,2026-04-28T05:34:58.657034+00:00,en,2026-04-26 11:30:00,https://platform.vox.com/wp-content/uploads/sites/2/2026/04/MartaMonteiro_Vox.jpg?quality=90&strip=all&crop=0%2C10.732984293194%2C100%2C78.534031413613&w=1200,Vox,NewsAPI,Caregiving has a burnout problem - vox.com,https://www.vox.com/explain-it-to-me/486693/caregiving-burnout-family-parents-children-secondhand-stress
Olly Smith,broad_news,Other,"The Steam Machine may not be as ""competitively priced"" as we hoped.",Unknown,2026-04-28T05:34:58.657034+00:00,en,2026-04-26 11:18:07,https://resizer.ladbiblegroup.com/ogimage/v3/assets/bltbc1876152fcd9f07/blt814b9193689b8506/69edf2fc5d7a8d2e6ef2099c/steammachinecontroller.jpg,Gamingbible.com,NewsAPI,"New Valve Hardware Given Pricing Update, Steam Machine Hopes Crushed - GAMINGbible",https://www.gamingbible.com/news/platform/pc/steam-machine-controller-pricing-update-608564-20260426
Evan MacDonald,broad_news,Other,A Texas woman learned she had a rare genetic disorder after decades of unexplained pain and neurological symptoms. Here's how she unlocked the mystery.,Unknown,2026-04-28T05:34:58.657034+00:00,en,2026-04-26 11:13:28,https://s.hdnux.com/photos/01/66/04/01/30949498/3/rawImage.jpg,Houston Chronicle,NewsAPI,A Baytown mom suffered for decades. A family clue changed everything. - Houston Chronicle,https://www.houstonchronicle.com/health/article/texas-medical-mystery-severe-pain-disorder-22220416.php
Rachel Swan,broad_news,Other,ALS took this California man's voice. A brain implant helped him speak to his daughter again,Unknown,2026-04-28T05:34:58.657034+00:00,en,2026-04-26 11:11:11,https://s.hdnux.com/photos/01/66/04/53/30952143/5/rawImage.jpg,San Francisco Chronicle,NewsAPI,ALS took his voice. A brain implant helped him speak to his daughter again - San Francisco Chronicle,https://www.sfchronicle.com/bayarea/article/als-brain-implant-speech-21359382.php
Serena Pratt,broad_news,Turkey,"As a dietitian, I buy items like turkey burgers, steamed lentils, frozen berries, salted edamame, and seeded bread at Trader Joe's for easy meals.",Unknown,2026-04-28T05:34:58.657034+00:00,en,2026-04-26 11:02:00,https://i.insider.com/69ea4b5fa98bc8fdc096dfc6?width=1200&format=jpeg,Business Insider,NewsAPI,"I'm a dietitian who loves shopping at Trader Joe's. Here are 12 items I rely on to make easy, nutritious meals. - Business Insider",https://www.businessinsider.com/best-things-trader-joes-easy-meals-dietitian-recommendations-2026-4
Unknown,broad_news,Other,Your so-called biological age can reveal a lot about your longevity. Here's what the term means and what you need to do to slow down time.,Unknown,2026-04-28T05:34:58.657034+00:00,en,2026-04-26 11:00:18,https://img.huffingtonpost.com/asset/654bc1db230000e271ea57e5.jpeg?ops=1200_630,HuffPost,NewsAPI,Data Shows Following These 8 Habits May Reduce Your 'Biological Age' - HuffPost,https://www.huffpost.com/entry/slow-down-biological-age-goog_l_69e7bb4de4b0dc1990b6ab4e
Unknown,broad_news,Other,"Earlier this month on Phoronix we were the first to draw attention to a new fuzzing tool / AI bot uncovering kernel bugs by Greg Kroah-Hartman, the 'second in command' for Linux kernel development and stable maintainer",Unknown,2026-04-28T05:34:58.657034+00:00,en,2026-04-26 11:00:00,https://www.phoronix.net/image.php?id=2026&image=clanker_ryzen_ai_max,Phoronix,NewsAPI,The New Linux Kernel AI Bot Uncovering Bugs Is A Local LLM On Framework Desktop + AMD Ryzen AI Max - Phoronix,https://www.phoronix.com/news/Clanker-T1000-AMD-Ryzen-AI-Max
Maya Posch,broad_news,Other,"As unloved as IBM’s PCjr was, with only a one-year production run, it’s hard to complain about the documentation available for it. This includes the x86 assembly listing for the BIOS, w…",Unknown,2026-04-28T05:34:58.657034+00:00,en,2026-04-26 11:00:00,https://hackaday.com/wp-content/uploads/2026/04/IBM_PCB_Jr_Internal.jpg,Hackaday,NewsAPI,Building An IBM PCjr BIOS From Source Using Original Printed Source Code - Hackaday,https://hackaday.com/2026/04/26/building-an-ibm-pcjr-bios-from-source-using-original-printed-source-code/
Chris Smith,broad_news,Other,Wearing AirPods or other earbuds in your ears all day long can reduce airflow and interfere with earwax production. Constant loud music can also damage hearing.,Unknown,2026-04-28T05:34:58.657034+00:00,en,2026-04-26 10:47:00,https://www.bgr.com/img/gallery/what-happens-if-you-wear-your-airpods-all-day/l-intro-1776089859.jpg,BGR,NewsAPI,What Happens If You Wear Your AirPods All Day? - bgr.com,https://www.bgr.com/2146612/is-it-safe-wear-airpods-all-day/
Zac Bowden,broad_news,Other,Microsoft has restructured its Windows team to better position Windows 11 as a strong platform that people should want to use. Here's how it's going about that.,Unknown,2026-04-28T05:34:58.657034+00:00,en,2026-04-26 10:37:23,https://cdn.mos.cms.futurecdn.net/oufEx2VJJSiJJpD745PddN-2560-80.jpg,Windows Central,NewsAPI,Inside Windows K2: Microsoft's major plan to save Windows 11 and win back users before it's too late - Windows Central,https://www.windowscentral.com/microsoft/windows-11/what-is-windows-k2-everything-you-need-to-know-saving-windows-11
Olly Smith,broad_news,Other,A new bug appeared for some PlayStation users over the weekend.,Unknown,2026-04-28T05:34:58.657034+00:00,en,2026-04-26 10:34:11,https://resizer.ladbiblegroup.com/ogimage/v3/assets/bltbc1876152fcd9f07/blt930da56534a673db/69ede89f08a8265de7e03c20/Screenshot_2025-12-10_at_09.12.03.png,Gamingbible.com,NewsAPI,PlayStation Users Given 'Expired Games' Scare Following Update - GAMINGbible,https://www.gamingbible.com/news/platform/playstation/playstation-4-expired-games-warning-671455-20260426
