author,category,country,description,domain,fetched_at,language,published_at,social_image,source_name,source_system,title,url
Cameron Faulkner,broad_news,Other,"The new Alienware AW2726DM QD-OLED delivers 1440p resolution, 240Hz refresh rate, and amazing contrast at a digestible $350 price point.",Unknown,2026-04-24T13:01:06.351591+00:00,en,2026-04-22 14:00:00,https://platform.theverge.com/wp-content/uploads/sites/2/2026/04/aw4.jpg?quality=90&strip=all&crop=0%2C10.73839968634%2C100%2C78.523200627319&w=1200,The Verge,NewsAPI,I bought Alienware’s $350 OLED monitor and I can’t believe how good it is - The Verge,https://www.theverge.com/tech/916277/alienware-aw2726dm-qdoled-gaming-monitor-specs-hands-on
Push Square,broad_news,United States,A wild Pokopia appears,Unknown,2026-04-23T15:53:53.822381+00:00,en,2026-04-22 14:00:00,https://images.pushsquare.com/f037582eb663b/large.jpg,Push Square,NewsAPI,Mar 2026 USA Sales: Pokémon-Powered Switch 2 Finally Beats 5-Year-Old PS5 - Push Square,https://www.pushsquare.com/news/2026/04/mar-2026-usa-sales-pokemon-powered-switch-2-finally-beats-5-year-old-ps5
WSJ,broad_news,Other,No description,Unknown,2026-04-23T15:53:53.822381+00:00,en,2026-04-22 13:58:00,N/A,The Wall Street Journal,NewsAPI,"Boeing’s Commercial Jet Business Improves, Reducing Quarterly Loss - WSJ",https://www.wsj.com/business/earnings/boeing-ba-q1-earnings-report-stock-2026-e9c2aa35
Unknown,broad_news,Other,"All-vehicle armies and mounted Space Marine infantry? Yes, please!",Unknown,2026-04-23T15:53:53.822381+00:00,en,2026-04-22 13:57:25,https://assets.warhammer-community.com/40k_smdetachments-apr22-1-feature-xzsmmz7lvq.jpg,Warhammer-community.com,NewsAPI,Zoom across Armageddon with new Space Marine Detachments - Warhammer Community,https://www.warhammer-community.com/articles/ubr2cptv/zoom-across-armageddon-with-new-space-marine-detachments
Brian,broad_news,Other,Check out the first actual gameplay of Yoshi and the Mysterious Book on Nintendo Switch 2.,Unknown,2026-04-23T15:53:53.822381+00:00,en,2026-04-22 13:55:20,https://nintendoeverything.com/wp-content/uploads/Yoshi-and-the-Mysterious-Book-gameplay-1.jpg,Nintendoeverything.com,NewsAPI,Yoshi and the Mysterious Book gets first gameplay on Nintendo Switch 2 - Nintendo Everything,https://nintendoeverything.com/yoshi-and-the-mysterious-book-gets-first-gameplay-on-nintendo-switch-2/
Unknown,broad_news,Iran,"Iran attacked two vessels in the Strait of Hormuz on Wednesday after President Donald Trump extended a U.S. ceasefire in the region, allowing Tehran more time to present a ""unified proposal.""",Unknown,2026-04-23T15:53:53.822381+00:00,en,2026-04-22 13:52:51,https://assets.foxnews.com/liveblog/fn/prod/images/2026/04/494734b768d09583d8739bbf427b4976.jpg,Fox News,NewsAPI,Iran fires on 2 ships in Strait of Hormuz after Trump extends ceasefire - Fox News,https://www.foxnews.com/live-news/iran-us-war-blockade-hormuz-april-22
Diana Olick,broad_news,Other,Life science laboratories saw a massive drop in demand last year after the NIH was forced to cancel billions of dollars in research grants.,Unknown,2026-04-23T15:53:53.822381+00:00,en,2026-04-22 13:51:10,https://image.cnbcfm.com/api/v1/image/108293998-1776697224392-gettyimages-1124558400-g1832_0372.jpeg?v=1776697269&w=1920&h=1080,CNBC,NewsAPI,Life sciences lab real estate is clawing back from disaster. Here’s what that means for investors - CNBC,https://www.cnbc.com/2026/04/22/life-sciences-lab-real-estate-rebound.html
Ali Swenson,broad_news,Other,Sen. Bill Cassidy faces a tough situation as he questions Robert F. Kennedy Jr. in two Senate hearings. Cassidy supported Kennedy's confirmation as health secretary but is a strong vaccine advocate and has clashed with him over vaccine policies. Kennedy was a…,Unknown,2026-04-23T15:53:53.822381+00:00,en,2026-04-22 13:51:00,https://dims.apnews.com/dims4/default/f49d091/2147483647/strip/true/crop/4346x2896+0+1/resize/980x653!/quality/90/?url=https%3A%2F%2Fassets.apnews.com%2F9f%2F28%2F2a4ce8991a8f2fe9d39d2b1c5f2b%2Fee54c39ee83d4ffeaea0c121066aee33,Associated Press,NewsAPI,RFK Jr. goes before the Senate. One lawmaker’s competing loyalties will be on display - AP News,https://apnews.com/article/bill-cassidy-rfk-jr-trump-vaccines-health-de23656aac2f41ec592c5243d83333b0
Sally Younger,broad_news,Other,"From cameras pressed against spacecraft windows to the most powerful radar ever flown, imaging technology has taken giant leaps since 1968, but the drive to understand our home in the cosmos has remained.",Unknown,2026-04-24T13:01:06.351591+00:00,en,2026-04-22 13:38:53,https://assets.science.nasa.gov/content/dam/science/esd/articles/2026/art002e014070.jpg/jcr:content/renditions/cq5dam.web.1280.1280.jpeg,NASA,NewsAPI,Advancing Earth Observation at NASA Since Release of Earthrise Photo - NASA Science (.gov),https://science.nasa.gov/earth/advancing-earth-observation-at-nasa-since-release-of-earthrise-photo/
TOI Lifestyle Desk,broad_news,India,"Wellness News: Discover how groundbreaking research links gut bacteria to Parkinson's disease risk, revealing early warning signs that could transform prevention and treatment strategies.",Unknown,2026-04-25T10:59:02.929112+00:00,en,2026-04-22 13:32:00,"https://static.toiimg.com/thumb/msid-130443181,width-1280,height-720,imgsize-436060,resizemode-6,overlay-toi_sw,pt-32,y_pad-600/photo.jpg",The Times of India,NewsAPI,Forget the tremors: Your gut holds clues to your risk of Parkinson’s disease - The Times of India,https://timesofindia.indiatimes.com/etimes/wellness/forget-the-tremors-your-gut-holds-clues-to-your-risk-of-parkinsons-disease/articleshow/130443106.cms
"Carolyn Y. Johnson, Christopher Rowland",broad_news,United States,Pancreatic cancer has stymied treatment advances for decades. Data from new clinical trials shows promise.,Unknown,2026-04-23T15:53:53.822381+00:00,en,2026-04-22 13:31:50,https://www.washingtonpost.com/wp-apps/imrs.php?src=https://arc-anglerfish-washpost-prod-washpost.s3.amazonaws.com/public/4UHFWWWGKDY7V5GDQVUPWLHU4I_size-normalized.jpg&w=1440,The Washington Post,NewsAPI,Why these treatments for one of the deadliest cancers are stirring such hope - The Washington Post,https://www.washingtonpost.com/health/2026/04/22/cancer-pancreatic-treatment-clinical-trial/
Andrea Sachs,broad_news,United States,"Book as soon as possible for the first half of the peak season, and expect higher prices in Europe and Asia.",Unknown,2026-04-23T15:53:53.822381+00:00,en,2026-04-22 13:31:39,https://www.washingtonpost.com/wp-apps/imrs.php?src=https://cloudfront-us-east-1.images.arcpublishing.com/wapo/OFMKFH7URRE4NJRXK3RR5FO2RI.jpg&w=1440,The Washington Post,NewsAPI,Fuel shortage wreaks havoc on summer air travel. Here’s what to know. - The Washington Post,https://www.washingtonpost.com/travel/2026/04/22/summer-airfares-fuel-shortage/
"David K. Li, Samantha Cookinham",broad_news,Other,"Alan Osmond, oldest member of the famed family singing group The Osmonds, has died, leaving a legacy of having ""quietly carried so much responsibility so the rest of us could shine,"" his loved ones said Tuesday",Unknown,2026-04-23T15:53:53.822381+00:00,en,2026-04-22 13:29:00,"https://media-cldnry.s-nbcnews.com/image/upload/t_nbcnews-fp-1200-630,f_auto,q_auto:best/rockcms/2026-04/2604221-alan-osmond-mn-1105-8bc8a3.jpg",NBC News,NewsAPI,"Alan Osmond, oldest brother in family music group The Osmonds, dies at 76 - NBC News",https://www.nbcnews.com/pop-culture/pop-culture-news/alan-osmond-oldest-brother-family-music-group-osmonds-dies-76-rcna341214
Rebecca Cohen,broad_news,Other,"Two doctoral students at the University of South Florida are missing, the school's police department said in a statement Tuesday.",Unknown,2026-04-23T15:53:53.822381+00:00,en,2026-04-22 13:21:52,"https://media-cldnry.s-nbcnews.com/image/upload/t_nbcnews-fp-1200-630,f_auto,q_auto:best/rockcms/2026-04/260422-usf-missing-students-mb-1303-0cef32.jpg",NBC News,NewsAPI,"Two University of South Florida doctoral students are missing, police say - NBC News",https://www.nbcnews.com/news/us-news/two-university-south-florida-doctoral-students-are-missing-police-say-rcna341385
Reuters,broad_news,Russia,"Russian oil flowed through the Ukrainian section of the Druzhba pipeline on Wednesday after a halt lasting months, officials said, allowing Hungary to lift its veto on a 90 billion euro ($105.79 billion) E.U. loan urgently needed by Kyiv",Unknown,2026-04-23T15:53:53.822381+00:00,en,2026-04-22 13:21:27,"https://media-cldnry.s-nbcnews.com/image/upload/t_nbcnews-fp-1200-630,f_auto,q_auto:best/rockcms/2026-04/260422-Druzhba-pipeline-hungary-mn-0855-22af93.jpg",NBC News,NewsAPI,"Druzhba pipeline restarts Russian oil flows to Europe, unblocking E.U. loan for Kyiv - NBC News",https://www.nbcnews.com/world/ukraine/druzhba-pipeline-restarts-russian-oil-flows-europe-unblocking-eu-loan-rcna341394
Ian King,broad_news,Other,"Alphabet Inc.’s Google Cloud division unveiled the latest generation of its tensor processing unit, or TPU, a homegrown chip that’s designed to make AI computing services faster and more efficient.",Unknown,2026-04-23T15:53:53.822381+00:00,en,2026-04-22 13:01:36,https://assets.bwbx.io/images/users/iqjWHBFdfxIU/i6eLlvpFXMEk/v1/1200x800.jpg,Bloomberg,NewsAPI,Google Cloud Releases New TPU Chip Lineup in Bid to Speed Up AI - Bloomberg,https://www.bloomberg.com/news/articles/2026-04-22/google-cloud-releases-new-tpu-chip-lineup-in-bid-to-speed-up-ai
Unknown,broad_news,Other,Most men know stress can affect the libido. But they don’t realize stress may also affect sperm health. Here’s what men can do to produce healthy sperm.,Unknown,2026-04-24T13:01:06.351591+00:00,en,2026-04-22 13:01:10,"https://media.cnn.com/api/v1/images/stellar/prod/gettyimages-460716005.jpg?c=16x9&q=w_800,c_fill",CNN,NewsAPI,What men can do to produce healthy sperm - CNN,https://www.cnn.com/2026/04/22/health/fertility-stress-sperm-health-wellness
Rebekah Valentine,broad_news,Other,MLB The Show 26 took the top spot,Unknown,2026-04-25T10:59:02.929112+00:00,en,2026-04-22 13:01:05,https://kotaku.com/app/uploads/2025/06/44fbd5eb5d27cc645b2c2a9047bc16d0-1200x675.jpg,Kotaku,NewsAPI,Marathon Was One Of March’s Best-Selling Games But That Probably Won’t Stop The Obsession Over Steam Charts - Kotaku,https://kotaku.com/marathon-march-fourth-best-selling-game-us-2000689473
Howard Dean,broad_news,United States,The HHS secretary's congressional testimony underscores that the nation is unprepared for disease outbreaks,Unknown,2026-04-23T15:53:53.822381+00:00,en,2026-04-22 13:00:21,https://www.salon.com/app/uploads/2026/04/Robert-F.-Kennedy-Jr.-2271892087.jpg,Salon,NewsAPI,America isn’t prepared for what comes after the measles crisis - Salon.com,https://www.salon.com/2026/04/22/america-isnt-prepared-for-what-comes-after-the-measles-crisis/
Giovanni Colantonio,broad_news,Other,Titanium Court fuses multiple genres together to create an absurd and inventive strategy game that delights in messing with you.,Unknown,2026-04-23T15:53:53.822381+00:00,en,2026-04-22 13:00:19,https://static0.polygonimages.com/wordpress/wp-content/uploads/2026/04/titanium-court-puzzle-close-up.jpg?w=1600&h=900&fit=crop,Polygon,NewsAPI,2026 has a worthy Blue Prince contender that also plays like Candy Crush - Polygon.com,https://www.polygon.com/titanium-court-review/
Unknown,broad_news,Other,No description,Unknown,2026-04-23T15:53:53.822381+00:00,en,2026-04-22 13:00:00,N/A,OregonLive,NewsAPI,Dear Doctor: How are degenerative meniscal tears treated in patients over 50? - OregonLive.com,https://www.oregonlive.com/advice/2026/04/dear-doctor-how-are-degenerative-meniscal-tears-treated-in-patients-over-50.html
Paul Roberts,broad_news,Other,"As new details of the Nashville plan spread, reaction in Seattle ran the gamut. Many questioned what is next for the company’s presence in Seattle.",Unknown,2026-04-24T13:01:06.351591+00:00,en,2026-04-22 13:00:00,https://images.seattletimes.com/wp-content/uploads/2026/04/04212026_sbux_164556.jpg?d=1200x630,The Seattle Times,NewsAPI,Seattle grows bitter over Starbucks expansion in Nashville - The Seattle Times,https://www.seattletimes.com/business/starbucks/starbucks-expansion-in-nashville-brews-bitterness-in-seattle/
Alexis Ong,broad_news,Other,"Titanium Court, a new indie game from developer AP Thomson, is a strange mixture of genres that’s available now on Steam.",Unknown,2026-04-24T13:01:06.351591+00:00,en,2026-04-22 13:00:00,https://platform.theverge.com/wp-content/uploads/sites/2/2026/04/library_logo_billboard.webp?quality=90&strip=all&crop=0%2C3.4613147178592%2C100%2C93.077370564282&w=1200,The Verge,NewsAPI,The year’s weirdest game is hard to explain and even harder to put down - The Verge,https://www.theverge.com/entertainment/915891/titanium-court-review-indie-game
Jason Gay,broad_news,Other,"After 12 straight defeats, surrender flags are out for the mega-payroll New York club. Obviously, it’s the mayor’s fault.",Unknown,2026-04-23T15:53:53.822381+00:00,en,2026-04-22 13:00:00,https://images.wsj.net/im-89804764/social,The Wall Street Journal,NewsAPI,Season From HeLLLLLLLLLLLL: Miserable Mets Can’t Stop Losing - WSJ,https://www.wsj.com/sports/baseball/mets-cant-stop-losing-aed87b49
Andrew J. Hawkins,broad_news,Other,"BMW revealed its updated 7 Series built on its next-gen Neue Klasse platform, with enhanced computing power and an improved battery. And then there’s that grille.",Unknown,2026-04-23T15:53:53.822381+00:00,en,2026-04-22 13:00:00,https://platform.theverge.com/wp-content/uploads/sites/2/2026/04/01_0033.jpg?quality=90&strip=all&crop=0%2C10.732984293194%2C100%2C78.534031413613&w=1200,The Verge,NewsAPI,BMW’s flagship 7 Series gets its ‘Neue Klasse’ upgrade - The Verge,https://www.theverge.com/transportation/915630/bmw-7-series-neue-klasse-range-price-specs
Lucas Bell,broad_news,Other,Gunther Werks doesn't want to name the owner of this bespoke Porsche 911-based speedster. But the Iron man-themed livery and Infinity Gauntlet shifter certainly make an impression.,Unknown,2026-04-24T13:01:06.351591+00:00,en,2026-04-22 13:00:00,"https://hips.hearstapps.com/hmg-prod/images/dfa744e4-b438-4bc0-81ec-a30d0373d970.jpg?crop=0.853xw:0.639xh;0.114xw,0.115xh&resize=1200:*",RoadandTrack.com,NewsAPI,The Gunther Werks 'Project Endgame' Turbo Speedster Is a Truly Marvelous One-Off 911 - Road & Track,https://www.roadandtrack.com/news/a71088283/gunther-werks-turbo-speedster-porsche-911-project-endgame/
Brian,broad_news,Other,"Without diving into spoilers, The Super Mario Galaxy delves more into Princess Peach as a character and her backstory. According to Shigeru Miyamoto, this is something Nintendo will look to adhere to moving forward. Nintendo Dream recently mentioned to Miyamo…",Unknown,2026-04-23T15:53:53.822381+00:00,en,2026-04-22 12:55:29,https://nintendoeverything.com/wp-content/uploads/Peach-Mario-Galaxy-Movie-backstory.jpg,Nintendoeverything.com,NewsAPI,Miyamoto wants to adhere to Peach's backstory in The Super Mario Galaxy Movie in future games - Nintendo Everything,https://nintendoeverything.com/miyamoto-wants-to-adhere-to-peachs-backstory-in-the-super-mario-galaxy-movie-in-future-games/
Brian Sozzi,broad_news,Other,An Elon reminder on earnings day for Tesla.,Unknown,2026-04-23T15:53:53.822381+00:00,en,2026-04-22 12:50:36,https://s.yimg.com/ny/api/res/1.2/_ZKyJstEgaAuwXkPFxi6Aw--/YXBwaWQ9aGlnaGxhbmRlcjt3PTEyMDA7aD04MDA-/https://s.yimg.com/os/creatr-uploaded-images/2026-04/933dc670-3e49-11f1-b3bd-ebbdc19a7feb,Yahoo Entertainment,NewsAPI,One Elon Musk superpower to remember on Tesla earnings day - Yahoo Finance,https://finance.yahoo.com/news/one-elon-musk-superpower-to-remember-on-tesla-earnings-day-125036490.html
Arthur Sullivan,broad_news,Iran,"The impact of jet fuel shortages because of the closure of the Strait of Hormuz is starting to burn. Lufthansa has canceled 20,000 flights and experts warn more cancellations and price hikes are on the way.",Unknown,2026-04-23T15:53:53.822381+00:00,en,2026-04-22 12:45:00,https://static.dw.com/image/76804604_6.jpg,DW (English),NewsAPI,Iran war: Jet fuel crisis deepens as Lufthansa cuts flights - dw.com,https://www.dw.com/en/iran-war-lufthansa-flights-cancellation-kerosene-fuel-energy-crisis-strait-of-hormuz/a-76889141
Michael Birnbaum,broad_news,Iran,"As U.S. envoys pursue peace talks, the president confronts persistent sticking points: sanctions relief, enrichment limits and the risk of empowering Tehran.",Unknown,2026-04-23T15:53:53.822381+00:00,en,2026-04-22 12:40:25,https://www.washingtonpost.com/wp-apps/imrs.php?src=https://cloudfront-us-east-1.images.arcpublishing.com/wapo/VKPGOIPXUHIV5B3RXR3WIMI4QI.jpg&w=1440,The Washington Post,NewsAPI,Trump blasted Obama’s Iran deal. Now he faces similar tradeoffs. - The Washington Post,https://www.washingtonpost.com/politics/2026/04/22/trump-iran-negotiations-obama/
Kayla Blanton,broad_news,Other,A new study looks at how bedtime affects heart disease risk. Those with irregular bedtimes had double the heart disease risk after 10 years. A sleep specialist and cardiologist share their thoughts.,Unknown,2026-04-23T15:53:53.822381+00:00,en,2026-04-22 12:32:40,"https://hips.hearstapps.com/hmg-prod/images/31542bf2-3a06-4d29-9c28-c4f5d4d90e10.jpeg?crop=1xw:0.75xh;0xw,0.167xh&resize=1200:*",Prevention.com,NewsAPI,"This Simple Habit Change Could Decrease Heart Disease Risk by 50%, Scientists Say - Prevention",https://www.prevention.com/health/health-conditions/a71028214/bedtime-consistency-heart-disease-study/
Unknown,broad_news,Other,"A stress-related protein may help some brains resist Alzheimer’s decline, keeping memory and function intact despite damage.",Unknown,2026-04-24T13:01:06.351591+00:00,en,2026-04-22 12:26:54,https://cff2.earth.com/uploads/2026/04/22062357/Stress-protein-Alzheimers.jpg,Earth.com,NewsAPI,Scientists discover why some brains resist Alzheimer’s decline - Earth.com,https://www.earth.com/news/scientists-discover-why-some-brains-resist-alzheimers-decline/
KTLA,broad_news,Other,No description,Unknown,2026-04-23T15:53:53.822381+00:00,en,2026-04-22 12:21:37,N/A,KTLA Los Angeles,NewsAPI,"Social Security offices in California, several other states temporarily closed. See list here - KTLA",https://ktla.com/news/california/social-security-offices-temporarily-closed/
"Star Tribune staff, Star Tribune staff",broad_news,Other,Corie Barry will step down; company lifer Jason Bonfig will take the helm in November.,Unknown,2026-04-23T12:17:18.160664+00:00,en,2026-04-22 12:20:47,https://arc.stimg.co/startribunemedia/3LUJMFCQN5BCZAIVKBLVAYCL74.jpg?&w=1200&ar=1.91:1&fit=crop,Minneapolis Star Tribune,NewsAPI,Live: Best Buy CEO to leave as company seeks path to steady growth - Star Tribune,https://www.startribune.com/best-buy-ceo-transition-corie-barry-jason-bonfig/601783306
Unknown,broad_news,Other,"The assault-style rifle used to kill eight children in a Louisiana mass shooting was stolen from a truck, the gun's previous owner said.",Unknown,2026-04-23T15:53:53.822381+00:00,en,2026-04-22 12:18:00,https://assets1.cbsnewsstatic.com/hub/i/r/2026/04/22/9f4296a2-32bd-4ae8-a7cc-26d7985df436/thumbnail/1200x630/2da0ae2e501f1162ad61764a72b5b72b/gun-used-in-killing-0.jpg,CBS News,NewsAPI,Man charged for previously having gun used to kill 8 children in Louisiana says it was stolen from his truck - CBS News,https://www.cbsnews.com/news/lousiana-shooting-man-charged-gun-stolen-truck/
Nicole Winfield,broad_news,Other,"Pope Leo XIV is urging Equatorial Guineans to work for freedom, justice and to close the gap “between the privileged and the disadvantaged.” Leo opened his day with a Mass in Mongomo. The eastern city is on the border with Gabon and has experienced major deve…",Unknown,2026-04-23T15:53:53.822381+00:00,en,2026-04-22 12:16:00,https://dims.apnews.com/dims4/default/ef7d6db/2147483647/strip/true/crop/3764x2508+0+1/resize/980x653!/quality/90/?url=https%3A%2F%2Fassets.apnews.com%2Fce%2F69%2Fbaf86ec03b906e275e3fe581c0a6%2Ffebfc141ff0b475f904f93fef7dc941d,Associated Press,NewsAPI,Pope calls for justice and closing income gap in Equatorial Guinea Mass with presidential family - AP News,https://apnews.com/article/africa-pope-prison-human-rights-538f891c41446fbaa97eb36b9b1c2284
Unknown,broad_news,Other,"Ancient DNA from a tomb near Paris reveals a shocking prehistoric reset: one population vanished and was replaced by newcomers from the south. The two groups show no genetic connection, signaling a major upheaval around 3000 BC. Disease, including early plagu…",Unknown,2026-04-25T10:59:02.929112+00:00,en,2026-04-22 12:13:30,https://www.sciencedaily.com/images/1920/standing-stone-monument-megalithic-tomb-dolmen.webp,Science Daily,NewsAPI,Ancient DNA reveals a lost population near Paris replaced by strangers - Science Daily,https://www.sciencedaily.com/releases/2026/04/260421042800.htm
Matt Growcoot,broad_news,Other,Cooling off.,Unknown,2026-04-23T15:53:53.822381+00:00,en,2026-04-22 12:10:34,https://petapixel.com/assets/uploads/2026/04/heatshield1.jpg,PetaPixel,NewsAPI,Haunting NASA Photo Shows Artemis II Heat Shield in the Ocean - PetaPixel,https://petapixel.com/2026/04/22/haunting-nasa-photo-shows-artemis-ii-heat-shield-in-the-ocean/
Unknown,broad_news,Other,"New Call of Duty games will be added to the subscription service ""about a year"" after release, Microsoft said.",Unknown,2026-04-23T15:53:53.822381+00:00,en,2026-04-22 12:03:10,https://ichef.bbci.co.uk/news/1024/branded_news/80df/live/35601e70-3e55-11f1-ac78-2112837ce2aa.png,BBC News,NewsAPI,Xbox cuts prices for Game Pass but ends day-one Call of Duty access - BBC,https://www.bbc.com/news/articles/cgrlvvrn409o
Unknown,broad_news,Other,"As measles cases rise in Utah and across the U.S., some wonder of top LDS Church leaders will encourage vaccinations — as they did during the COVID-19 pandemic.",Unknown,2026-04-24T13:01:06.351591+00:00,en,2026-04-22 12:00:26,https://www.sltrib.com/resizer/v2/https%3A%2F%2Fcloudfront-us-east-1.images.arcpublishing.com%2Fsltrib%2FTGKJFUIHMVFEPH66G2NHMEPFBA.JPG?auth=5bd9d37cd656d0d3cfbd0f8e6a8ecbc3e6cebaf0e4ed4bb7858beb9988355581&width=1200,Salt Lake Tribune,NewsAPI,Will the LDS Church encourage its members to get the measles vaccine? We asked. Here’s the response. - The Salt Lake Tribune,https://www.sltrib.com/religion/2026/04/22/will-lds-church-speak-out-measles/
Unknown,broad_news,Other,"The 1,881% gain of Apple shares with Tim Cook as CEO might look stellar at first glance. But the stock was far from No. 1.",Unknown,2026-04-23T15:53:53.822381+00:00,en,2026-04-22 12:00:00,https://www.investors.com/wp-content/uploads/2023/04/Stock-applelogo-hand-01-adobe.jpg,Investor's Business Daily,NewsAPI,36 S&P 500 Stocks Blew Away Tim Cook's Apple With Less Fanfare - Investor's Business Daily,https://www.investors.com/etfs-and-funds/sectors/sp-500-stocks-blew-away-tim-cooks-apple-with-less-fanfare/
Abner Li,broad_news,Other,"At Cloud Next 2026, Google today announced “Workspace Intelligence” to provide “highly accurate, personalized context for every app.”",Unknown,2026-04-23T15:53:53.822381+00:00,en,2026-04-22 12:00:00,https://i0.wp.com/9to5google.com/wp-content/uploads/sites/4/2026/04/Google-Workspace-Intelligence-cover.jpg?resize=1200%2C628&quality=82&strip=all&ssl=1,9to5google.com,NewsAPI,Google announces ‘Workspace Intelligence’ and TPU 8t + 8i chips - 9to5Google,http://9to5google.com/2026/04/22/google-workspace-intelligence/
https://www.facebook.com/foodandwine,broad_news,Other,"Beer isn’t exactly a nutrition star, but there’s more to it than meets the eye. A study in the “Journal of Agricultural and Food Chemistry” analyzed 65 beers and found vitamin B6 across the board — a nutrient tied to mood, brain function, and energy metabolis…",Unknown,2026-04-25T10:59:02.929112+00:00,en,2026-04-22 12:00:00,https://www.foodandwine.com/thmb/L9UMMZp7Q9-NBH1bPpjxCExP02g=/1500x0/filters:no_upscale():max_bytes(150000):strip_icc()/NA-Beer-Mood-Boosting-Nutrient-FT-DGTL0426-be98cb25dfb04a9a9aa09938c56f8dd7.jpg,Food & Wine,NewsAPI,This Nonalcoholic Drink Serves Up to 59% of a Key Mood-Boosting Vitamin - Food & Wine,https://www.foodandwine.com/nonalcoholic-beer-vitamin-b6-study-11955059
Lucas Ropek,broad_news,Other,Generative AI is being infused into Google's popular feature within Maps.,Unknown,2026-04-23T15:53:53.822381+00:00,en,2026-04-22 12:00:00,"https://techcrunch.com/wp-content/uploads/2026/04/Screenshot-2026-04-21-at-5.26.25-PM.png?resize=1200,670",TechCrunch,NewsAPI,Google Maps is about to get a big dose of AI - TechCrunch,https://techcrunch.com/2026/04/22/google-maps-is-about-to-get-a-big-dose-of-ai/
Julie Bort,broad_news,Other,Google wants AI startups on its cloud and has showcased a long list of them at its annual conference.,Unknown,2026-04-23T15:53:53.822381+00:00,en,2026-04-22 12:00:00,"https://techcrunch.com/wp-content/uploads/2023/08/Google-Cloud-Next-_23_Thomas-Kurian_1.jpg?resize=1200,800",TechCrunch,NewsAPI,The most interesting startups showcased at Google Cloud Next 2026 - TechCrunch,https://techcrunch.com/2026/04/22/the-most-interesting-startups-showcased-at-google-cloud-next-2026/
Ashley DiMella,broad_news,United States,"Anheuser-Busch announces a $600 million U.S. investment to boost domestic production, expand veteran hiring and launch 15 new training centers.",Unknown,2026-04-23T15:53:53.822381+00:00,en,2026-04-22 11:50:00,https://a57.foxnews.com/static.foxbusiness.com/foxbusiness.com/content/uploads/2026/04/0/0/trump-budwiser-america-first-fox-news.jpg?ve=1&tl=1,Fox Business,NewsAPI,Beer giant pours $600M into US production in major bet on American growth - Fox Business,https://www.foxbusiness.com/politics/beer-giant-pours-600m-us-production-major-bet-american-growth
