author,category,country,description,domain,fetched_at,language,published_at,social_image,source_name,source_system,title,url
Unknown,broad_news,Other,"A new study links frequent, longer daytime naps in older adults to higher health risks — especially when they start in the morning.",Unknown,2026-04-26T16:34:07.301144+00:00,en,2026-04-24 09:01:51,https://bostonglobe-prod.cdn.arcpublishing.com/resizer/v2/BDTSBYQUDYXZUOAIY222RP33QU.jpg?auth=5fb90a6e210030b0e6c7fa58db18531f32b173f6579c6a332f88c728a27b5717&width=1440,The Boston Globe,NewsAPI,Your daily nap might be trying to tell you something - The Boston Globe,https://www.bostonglobe.com/2026/04/24/metro/naps-health-study-morning-monitored/
Beatrice Forman,broad_news,Other,"Roxanne, one of Philly's first restaurants to be honored by the Michelin Guide, was shut down after operating without a food license for more than a year.",Unknown,2026-04-26T16:34:07.301144+00:00,en,2026-04-24 09:01:01,https://www.inquirer.com/resizer/v2/W3EFPIJFDVCO7AUYFBL6PXD3DE.jpg?auth=c1630cb45fa24c1a17a3eb249ea36ae1c7689a118c7ac884ab75993b855bff39&width=760&height=507&smart=true,The Philadelphia Inquirer,NewsAPI,Michelin-recommended restaurant Roxanne shut down by city over licensing issues - Inquirer.com,https://www.inquirer.com/food/restaurants/roxanne-philadelphia-shut-down-food-license-michelin-recommendation-20260424.html
Michael David Smith,broad_news,Other,Rams GM Les Snead and coach Sean McVay never talked to Simpson in the pre-draft process.,Unknown,2026-04-25T10:59:02.929112+00:00,en,2026-04-24 08:49:10,https://nbcsports.brightspotcdn.com/dims4/default/ccba22c/2147483647/strip/true/crop/5818x3273+0+303/resize/1440x810!/quality/90/?url=https%3A%2F%2Fnbc-sports-production-nbc-sports.s3.us-east-1.amazonaws.com%2Fbrightspot%2F38%2F57%2Fafb4e41d4073b48a5835af9f8e78%2Fhttps-delivery-gettyimages.com%2Fdownloads%2F2272869026,NBCSports.com,NewsAPI,Rams’ surprising pick of Ty Simpson came after showing little interest before the draft - NBC Sports,https://www.nbcsports.com/nfl/profootballtalk/rumor-mill/news/rams-surprising-pick-of-ty-simpson-came-after-showing-little-interest-before-the-draft
Jez Corden,broad_news,Other,"World of Warcraft is the most popular subscription based MMORPG in history owing to the absolute mountain of content it receieves in exchange for the monthly fee. Lately, though, it feels increasingly like Blizzard has spread itself thin.",Unknown,2026-04-26T16:34:07.301144+00:00,en,2026-04-24 08:27:44,https://cdn.mos.cms.futurecdn.net/uSWxjupVxkNGJEmixZEoe5-786-80.jpg,Windows Central,NewsAPI,"""We care deeply about this game, and we play it right alongside you"": World of Warcraft team apologizes for the state of the game — as patch 12.0.5 frustration boils over - Windows Central",https://www.windowscentral.com/gaming/pc-gaming/world-of-warcraft-developers-lament-the-state-of-midnight-as-patch-12-0-5-frustration-boils-over
Unknown,broad_news,Other,"A powerful tornado in Oklahoma on Thursday ripped roofs off buildings, destroyed homes, knocked down power poles and forced an Air Force base to close.",Unknown,2026-04-25T10:59:02.929112+00:00,en,2026-04-24 07:31:00,https://assets3.cbsnewsstatic.com/hub/i/r/2026/04/24/22bfd8f9-6ece-4bd7-910b-505579f457f3/thumbnail/1200x630/9a971f62fa869f1be68b077535b74db4/tornado.jpg,CBS News,NewsAPI,"Tornado roars through Enid, Oklahoma, destroys homes, forces Air Force base to close - CBS News",https://www.cbsnews.com/news/tornado-roars-through-parts-of-oklahoma/
Digital Foundry,broad_news,Other,An Unreal Engine 5 game that looks nothing like it.,Unknown,2026-04-25T10:59:02.929112+00:00,en,2026-04-24 07:26:48,https://images.digitalfoundry.net/671f5fc827b1e/large.jpg,Digitalfoundry.net,NewsAPI,"Review: Saros on PS5/Pro: Beautiful Visuals, Polished And Approachable - Digital Foundry",https://www.digitalfoundry.net/reviews/saros-on-ps5pro-beautiful-visuals-polished-and-approachable
Daniel John,broad_news,Other,Should we actually be worried this time?,Unknown,2026-04-26T16:34:07.301144+00:00,en,2026-04-24 07:18:14,https://cdn.mos.cms.futurecdn.net/wQyPUSCjwSdtZN2cqdGPhb-1920-80.jpg,Creative Bloq,NewsAPI,ChatGPT Images 2.0 has people declaring the death of graphic design... again - Creative Bloq,https://www.creativebloq.com/design/graphic-design/chatgpt-images-2-0-has-people-declaring-the-death-of-graphic-design-again
Push Square,broad_news,Other,An all-new original story,Unknown,2026-04-26T16:34:07.301144+00:00,en,2026-04-24 06:00:00,https://images.pushsquare.com/c13c2a6034e92/large.jpg,Push Square,NewsAPI,Invincible VS' PS5 Story Trailer Has Fans Joking It Looks Better Than the Show - Push Square,https://www.pushsquare.com/news/2026/04/invincible-vs-ps5-story-trailer-has-fans-joking-it-looks-better-than-the-show
The Associated Press,broad_news,Other,"Two young people have been arrested in an alleged plot to attack a Texas synagogue that involved driving through the congregation to ""kill as many Jews as possible,"" according authorities.",Unknown,2026-04-25T10:59:02.929112+00:00,en,2026-04-24 05:45:37,https://npr.brightspotcdn.com/dims3/default/strip/false/crop/6000x3375+0+313/resize/1400/quality/85/format/jpeg/?url=http%3A%2F%2Fnpr-brightspot.s3.amazonaws.com%2Fe8%2Fd5%2Fadae4d114c05bb4e1ec1e2c0d840%2Fap26072503596197.jpg,NPR,NewsAPI,2 young people arrested in alleged plot to attack Houston synagogue - NPR,https://www.npr.org/2026/04/24/g-s1-118590/2-arrested-in-plot-to-attack-houston-synagogue
Unknown,broad_news,Other,Befriend Sableye and exchange red crystal fragments for unique items during this event.,Unknown,2026-04-26T16:34:07.301144+00:00,en,2026-04-24 05:05:25,https://www.pokemon.com/static-assets/content-assets/cms2/img/video-games/_tiles/pokemon-pokopia/2026/04/24/pokemon-pokopia-169.png,Pokemon.com,NewsAPI,Search for Treasure During Sableye’s Gem Hunt in Pokémon Pokopia - Pokemon.com,https://www.pokemon.com/us/pokemon-news/search-for-treasure-during-sableyes-gem-hunt-in-pokemon-pokopia
https://www.facebook.com/peoplemag,broad_news,Other,"A college student died just hours after experiencing symptoms of meningococcal disease, which is often mistaken for the flu. Alexander 'Zander' Philogene died at 21 after contracting the dangerous disease when he returned to Vienna, Austria, from Porto, Portu…",Unknown,2026-04-26T16:34:07.301144+00:00,en,2026-04-24 05:02:00,https://people.com/thmb/YVJ1ZWOTlx7WNkvq04iID58VJe4=/1500x0/filters:no_upscale():max_bytes(150000):strip_icc():focal(707x441:709x443)/zander-philogene-042326-ad70d6642868467c84cdd21659ce9f5c.jpg,PEOPLE,NewsAPI,College Student Dies Hours After First Showing Symptoms of Highly Contagious Deadly Disease Often Mistaken for the Flu - Yahoo News New Zealand,https://people.com/college-student-dies-hours-after-showing-symptoms-of-meningococcal-disease-11957689
Georgia Nicols,broad_news,Other,No description,Unknown,2026-04-25T10:59:02.929112+00:00,en,2026-04-24 05:01:00,https://cst.brightspotcdn.com/dims4/default/2145dbd/2147483647/strip/true/crop/870x497+0+67/resize/1461x834!/quality/90/?url=https%3A%2F%2Fchorus-production-cst-web.s3.us-east-1.amazonaws.com%2Fbrightspot%2Fac%2Ffd%2F790f04b15195427014757adc0272%2Fgeorgia-nicols.jpg,Suntimes.com,NewsAPI,"Horoscope for Friday, April 24, 2026 - Chicago Sun-Times",https://chicago.suntimes.com/horoscopes/2026/04/24/horoscopes-today-friday-april-24-2026
Vivian Chow,broad_news,Other,Orange County health officials have issued a warning after a rabid bat was discovered on the campus of Fullerton College. The bat was found on the stairs near the music building on the northeast corner of Chapman Avenue and Lemon Street on April 17 around 3:3…,Unknown,2026-04-26T16:34:07.301144+00:00,en,2026-04-24 04:42:34,https://ktla.com/wp-content/uploads/sites/4/2026/04/Copy-of-mug-or-photo-bkg-4-11.jpg?w=1280,KTLA Los Angeles,NewsAPI,"Rabid bat discovered on Fullerton College campus, health officials issue warning - KTLA",https://ktla.com/news/orange-county/rabid-bat-discovered-on-fullerton-college-campus/
Daniel Golson,broad_news,Other,"It's launching with the same base, S and 1,139-horsepower Turbo trims as the regular Cayenne Electric, with prices that start at around $5,000 more.",Unknown,2026-04-25T10:59:02.929112+00:00,en,2026-04-24 04:01:00,https://www.jalopnik.com/img/gallery/2026-porsche-cayenne-coupe-electric-is-here-because-40-of-cayenne-buyers-go-for-the-coupe/l-intro-1776984324.jpg,Jalopnik,NewsAPI,2026 Porsche Cayenne Coupe Electric Is Here Because 40% Of Cayenne Buyers Go For The Coupe - Jalopnik,https://www.jalopnik.com/2155963/2026-porsche-cayenne-coupe-electric-specs-reveal/
Rebecca Falconer,broad_news,Other,This appears to be the first prosecution for alleged insider trading on a prediction market.,Unknown,2026-04-25T10:59:02.929112+00:00,en,2026-04-24 03:53:45,https://images.axios.com/wUCo0RSE3xxE2AynsuC11ltzw3A=/0x75:3049x1790/1366x768/2026/04/23/1776982170417.jpeg,Axios,NewsAPI,U.S. special forces soldier arrested over Polymarket bets on Maduro raid - Axios,https://www.axios.com/2026/04/23/us-soldier-arrested-maduro-bet-polymarket
Unknown,broad_news,Iran,"ServiceNow, Freeport-McMoRan and Tesla also weighed on stocks Thursday.",Unknown,2026-04-25T10:59:02.929112+00:00,en,2026-04-24 03:05:00,https://www.investors.com/wp-content/uploads/2025/05/Stock-AIchip-motherboard-genAI-01-adobe.jpg,Investor's Business Daily,NewsAPI,Futures: Two AI Plays Jump After Iran News Hits Market - Investor's Business Daily,https://www.investors.com/market-trend/stock-market-today/dow-jones-futures-iran-news-servicenow-tesla-intel-soars-comfort-systems/
Rosy Cordero,broad_news,Other,"'Matlock' Boss Jennie Snyder Urman Breaks Down Season 2 Finale; Teases Time Jump, More Edwin Hodge.",Unknown,2026-04-25T10:59:02.929112+00:00,en,2026-04-24 03:00:00,https://deadline.com/wp-content/uploads/2026/04/3167012_1367b_ca6fcd.jpg?w=1024,Deadline,NewsAPI,"‘Matlock’ Boss Jennie Snyder Urman Breaks Down Season 2 Finale; Teases Time Jump, More Edwin Hodge - Deadline",http://deadline.com/2026/04/matlock-season-2-finale-interview-1236869887/
"Cory Weinberg, Julia Hornstein, Erin Woo, Katie Roof",broad_news,Other,"Weeks before Cursor agreed to a $60 billion potential takeover from SpaceX, the hot AI coding startup set out to raise billions of dollars. As its leaders made the rounds among tech’s largest investors, they started to hear an unfamiliar message: No, thanks. …",Unknown,2026-04-25T10:59:02.929112+00:00,en,2026-04-24 02:41:00,https://tii.imgix.net/production/articles/16984/b0fee05f-7479-40dd-b399-95a22269bbe6.png?fm=jpg&auto=compress&w=1200&frame=0,The Information,NewsAPI,"Behind Cursor’s Deal With SpaceX, Anthropic and Compute Costs Loomed Large - The Information",https://www.theinformation.com/articles/behind-cursors-deal-spacex-anthropic-compute-costs-loomed-large
Guru Baran,broad_news,Other,"A newly identified threat group, UNC6692, has been caught running a sophisticated multistage intrusion campaign that uses Microsoft Teams impersonation, a custom modular malware suite, and cloud infrastructure abuse to deeply penetrate enterprise networks, al…",Unknown,2026-04-26T16:34:07.301144+00:00,en,2026-04-24 02:20:41,http://cybersecuritynews.com/wp-content/uploads/2026/04/Microsoft-Teams-Breach-Organizations.webp,Cybersecuritynews.com,NewsAPI,Hackers Leverage Microsoft Teams to Breach Organizations Posing as IT Helpdesk Staff - CyberSecurityNews,https://cybersecuritynews.com/microsoft-teams-breach-organizations/
Lisa L. Colangelo,broad_news,Other,"Answers to a range of questions about the disease, which can cause severe symptoms in babies and young children.",Unknown,2026-04-26T16:34:07.301144+00:00,en,2026-04-24 01:43:48,https://cdn.newsday.com/ace/c:NTY2YTEyN2YtMWIzMy00:Zjc1OWU4MTMtMDJkNy00/landscape/1280,Newsday,NewsAPI,Rotavirus cases are on the rise. Here's what to know about the highly contagious disease. - Newsday,https://www.newsday.com/news/health/rotavirus-contagious-disease-b9kikfok
Unknown,broad_news,Other,No description,Unknown,2026-04-26T16:34:07.301144+00:00,en,2026-04-24 01:33:00,N/A,Ground.news,NewsAPI,Rectal cancer deaths in older millennials are rising rapidly - Ground News,https://ground.news/article/rectal-cancer-deaths-in-older-millennials-are-rising-rapidly
Patrik Walker,broad_news,Other,"Looking to continue their defensive rebuild, the Cowboys select Caleb Downs after trading up to grab him in the 2026 NFL Draft.",Unknown,2026-04-25T10:59:02.929112+00:00,en,2026-04-24 01:15:36,https://static.clubs.nfl.com/image/upload/t_editorial_landscape_12_desktop/cowboys/nsymuzgcxiizyedqhg9e,DallasCowboys.com,NewsAPI,Caleb Downs drafted by Cowboys as first-round pick - Dallas Cowboys | Official Site of the Dallas Cowboys,https://www.dallascowboys.com/news/caleb-downs-drafted-by-cowboys-as-first-round-pick
"Sebastian Starcevic, Nektaria Stamouli, Jacopo Barigazzi",broad_news,Other,"At the summit in Cypriot party town Ayia Napa, the comedown came quickly.",Unknown,2026-04-25T10:59:02.929112+00:00,en,2026-04-24 00:55:00,"https://www.politico.eu/cdn-cgi/image/width=1200,height=630,fit=crop,quality=80,onerror=redirect/wp-content/uploads/2026/04/24/GettyImages-2272091059-scaled.jpg",POLITICO.eu,NewsAPI,"After toasting €90B loan, EU leaders face up to the morning after - politico.eu",https://www.politico.eu/article/eu-leaders-summit-toasting-ukraine-loan-morning-after-challenges-defense-budget-iran/
https://gothamist.com/staff/ramsey-khalifeh,broad_news,Other,The March 22 crash came as seven different emergency vehicles scrambled to respond to another plane at the airport.,Unknown,2026-04-25T10:59:02.929112+00:00,en,2026-04-24 00:40:00,https://api-prod.gothamist.com/images/356608/fill-1200x650|format-webp|webpquality-85/,Gothamist,NewsAPI,NTSB report describes chaos at LaGuardia Airport ahead of deadly Air Canada crash - Gothamist,https://gothamist.com/news/ntsb-report-describes-chaos-at-laguardia-airport-ahead-of-deadly-air-canada-crash
World Health Organization: WHO,broad_news,Other,"<ul><li>The Big Catch-Up, launched during World Immunization Week 2023, has delivered over 100 million vaccine doses to an estimated 18.3 million children across 36 countries<strong><br /></strong></li><li>Around 12.3 million were “zero-dose children” who had…",Unknown,2026-04-26T16:34:07.301144+00:00,en,2026-04-24 00:10:43,https://cdn.who.int/media/images/default-source/topics/diseases-and-conditions/vaccines-and-immunization/poliovaccinationyemen2025.tmb-1200v.jpg?sfvrsn=3a6b8f8c_6,World Health Organization,NewsAPI,Largest catch-up initiative delivers over 100 million childhood vaccinations - World Health Organization (WHO),https://www.who.int/news/item/24-04-2026-largest-catch-up-initiative-delivers-over-100-million-childhood-vaccinations
The Conversation,broad_news,Other,"Think of how many surfaces you touch every day, from your kitchen bench to the handrail on the bus or train, your work desk, and your phone screen.",Unknown,2026-04-25T10:59:02.929112+00:00,en,2026-04-23 23:53:37,https://www.sciencealert.com/images/2026/04/Transparent-acrylic-samples-coated-in-virus-tearing-material-1.jpg,ScienceAlert,NewsAPI,Scientists Created a Plastic Film That Physically Rips Viruses Apart - ScienceAlert,https://www.sciencealert.com/scientists-created-a-plastic-film-that-physically-rips-viruses-apart
Inka Burow,broad_news,Other,"Researchers at Hannover Medical School (MHH) have developed a method for the efficient production of human immune cells, such as macrophages, in medium-sized bioreactors. These immune cells can be derived from induced pluripotent stem cells and are important …",Unknown,2026-04-26T16:34:07.301144+00:00,en,2026-04-23 23:40:01,https://scx2.b-cdn.net/gfx/news/hires/2026/cell-factory-for-the-i.jpg,Phys.Org,NewsAPI,"New bioreactor turns stem cells into an immune-cell factory, producing 40 million human macrophages per week - Phys.org",https://phys.org/news/2026-04-bioreactor-stem-cells-immune-cell.html
Lim Hui Jie,broad_news,Iran,Government data showed the inflation figure — which strips out prices of fresh food — was in line with the 1.8% expected by economists polled by Reuters.,Unknown,2026-04-25T10:59:02.929112+00:00,en,2026-04-23 23:34:31,https://image.cnbcfm.com/api/v1/image/108162965-1750743093357-gettyimages-2220269086-AFP_633Y39D.jpeg?v=1750822861&w=1920&h=1080,CNBC,NewsAPI,Japan core inflation accelerates after five months as Iran war stokes energy worries - CNBC,https://www.cnbc.com/2026/04/24/japan-cpi-march-inflation-iran-war-boj-rate.html
Cailey Griffin,broad_news,Other,Experts reveal four easy pelvic floor exercises for urinary incontinence that help stop bladder leaks after 50. Plus learn why focusing on your toes helps.,Unknown,2026-04-26T16:34:07.301144+00:00,en,2026-04-23 23:30:48,https://www.womansworld.com/wp-content/uploads/2026/04/pelvic-floor-exercises-incontinence.jpg?quality=86&strip=all,Womansworld.com,NewsAPI,4 Pelvic Floor Exercises for Incontinence That Stop Bladder Leaks Fast—No Kegels Needed - Woman's World,https://www.womansworld.com/wellness/pelvic-floor-exercises-for-incontinence-that-stop-bladder-leaks#article
Unknown,broad_news,Other,"A traditional medicinal plant, tormentil, shows promise against antibiotic-resistant bacteria in laboratory tests. Its compounds work by limiting bacterial growth and boosting antibiotic performance.",Unknown,2026-04-26T16:34:07.301144+00:00,en,2026-04-23 23:30:05,https://scitechdaily.com/images/Superbug-Illustration.jpg,SciTechDaily,NewsAPI,Forgotten Medicinal Plant Shows Promise in Fighting Dangerous Superbugs - SciTechDaily,https://scitechdaily.com/forgotten-medicinal-plant-shows-promise-in-fighting-dangerous-superbugs/
"Britney Nguyen, Emily Bary",broad_news,Other,Intel shares could see their best post-earnings performance on record and finally surpass their 2000 closing high amid a ‘CPU renaissance’,Unknown,2026-04-25T10:59:02.929112+00:00,en,2026-04-23 23:29:00,https://images.mktw.net/im-72309447/social,MarketWatch,NewsAPI,Why Intel’s stock is on track for a historic surge after earnings - MarketWatch,https://www.marketwatch.com/story/why-intels-stock-is-on-track-for-a-historic-surge-after-earnings-5128afa7
KOMO News Staff,broad_news,United States,Health officials in central Washington are responding to potential measles exposures at Valley View Elementary School in Ellensburg as the county enters outbrea,Unknown,2026-04-26T16:34:07.301144+00:00,en,2026-04-23 23:27:02,https://komonews.com/resources/media2/16x9/1104/1320/42x0/90/b5e73cf4-0239-415e-9296-6702038c0316-MEASLESPIC.png,KOMO News,NewsAPI,Measles exposure alert for Ellensburg school as Kittitas County hits outbreak status - KOMO,https://komonews.com/news/local/measles-exposure-alert-for-ellensburg-school-as-kittitas-county-hits-outbreak-status-public-health-confirmed-measles-cases-washington-state
Timi Cantisano,broad_news,Other,Multiview is now fully customizable,Unknown,2026-04-26T16:34:07.301144+00:00,en,2026-04-23 23:08:23,https://static0.anpoimages.com/wordpress/wp-content/uploads/wm/2024/09/youtube-tv-no-wm-2.jpg?w=1600&h=900&fit=crop,Android Police,NewsAPI,YouTube TV's best feature just got a game-changing upgrade - Android Police,https://www.androidpolice.com/youtube-tvs-best-feature-is-now-fully-customizable/
Unknown,broad_news,Other,"According to scientists, banana peel-based fertilizer outperforms chemical products and produces taller, healthier plants and crops.",Unknown,2026-04-25T10:59:02.929112+00:00,en,2026-04-23 23:07:19,https://cff2.earth.com/uploads/2025/12/23165422/plant-fertilizer_add-banana-peels_boosts-growth_1m.jpg,Earth.com,NewsAPI,"Common kitchen waste product makes plants grow taller and stronger, outperforming most fertilizers - Earth.com",https://www.earth.com/news/kitchen-waste-banana-peels-fertilizer-make-plants-and-crops-grow-taller-stronger/
Abdul Haddi,broad_news,Other,"Vampire Crawlers launched two days ago on Steam, and players are loving it so far. On Steam, it currently has over 98% positive reviews, which has earned it the ""Overwhelmingly Positive"" rating.",Unknown,2026-04-26T16:34:07.301144+00:00,en,2026-04-23 23:06:00,https://www.notebookcheck.net/fileadmin/Notebooks/News/_nc5/Vampire-Crawlers-Steam.jpg,Notebookcheck.net,NewsAPI,"Vampire Crawlers off to a strong start as it earns “Overwhelmingly Positive” rating on Steam with 4,600+ reviews - Notebookcheck",https://www.notebookcheck.net/Vampire-Crawlers-off-to-a-strong-start-as-it-earns-Overwhelmingly-Positive-rating-on-Steam-with-4-600-reviews.1281951.0.html
Unknown,broad_news,United States,"A massive long-term study tracking more than 650,000 Americans with irritable bowel syndrome is raising new concerns about the safety of some commonly used treatments.",Unknown,2026-04-26T16:34:07.301144+00:00,en,2026-04-23 23:05:45,https://scitechdaily.com/images/Medicine-Safety-Drug-Warning-Dangerous-Pain-Pills.jpg,SciTechDaily,NewsAPI,"Millions Take These IBS Drugs, But a New Study Finds Serious Risks - SciTechDaily",https://scitechdaily.com/millions-take-these-ibs-drugs-but-a-new-study-finds-serious-risks/
"Allyson Versprille, Catherine Lucey, Josh Wingrove",broad_news,Other,"President Donald Trump said he is considering having the US purchase Spirit Aviation Holdings Inc., saying it could be a potentially good investment for the federal government.",Unknown,2026-04-25T10:59:02.929112+00:00,en,2026-04-23 23:03:07,https://assets.bwbx.io/images/users/iqjWHBFdfxIU/isW.SBTK63RQ/v0/1200x800.jpg,Bloomberg,NewsAPI,Trump Says the US Is Weighing Purchase of Spirit Airlines - Bloomberg.com,https://www.bloomberg.com/news/articles/2026-04-23/trump-says-he-is-thinking-about-the-us-buying-spirit-airlines
"Chris Strohm, Redd Brown",broad_news,Other,"The US Justice Department reclassified state-regulated marijuana as a less dangerous drug, a major shift that could increase legal cannabis sales and help a struggling industry.",Unknown,2026-04-25T10:59:02.929112+00:00,en,2026-04-23 22:46:14,https://assets.bwbx.io/images/users/iqjWHBFdfxIU/ipOvEd7WFzZA/v1/1200x800.jpg,Bloomberg,NewsAPI,US Reduces Marijuana Restrictions in Lift to Ailing Industry - Bloomberg,https://www.bloomberg.com/news/articles/2026-04-23/us-reclassifies-state-licensed-marijuana-as-less-dangerous-drug
Tom Warren,broad_news,Other,Microsoft is getting ready to bundle Xbox Game Pass with Discord Nitro. A more limited “Starter Edition” is on the way.,Unknown,2026-04-25T10:59:02.929112+00:00,en,2026-04-23 22:36:39,https://platform.theverge.com/wp-content/uploads/sites/2/2026/04/discordxboxgamepass_bacddd.jpg?quality=90&strip=all&crop=0%2C10.732984293194%2C100%2C78.534031413613&w=1200,The Verge,NewsAPI,Leak reveals new Xbox Game Pass “Starter Edition” that’s part of Discord Nitro - The Verge,https://www.theverge.com/news/917880/xbox-game-pass-starter-edition-discord-nitro-bundle
Hokkaido University,broad_news,Other,"Today's octopuses are intelligent, remarkably flexible animals that lurk in reefs, hide in crevices, or drift through the deep sea. But new research suggests that their earliest relatives may have played a far more predatory role in ocean ecosystems. A study …",Unknown,2026-04-25T10:59:02.929112+00:00,en,2026-04-23 22:30:11,https://scx2.b-cdn.net/gfx/news/hires/2026/giant-octopuses-may-ha.jpg,Phys.Org,NewsAPI,Giant octopuses may have ruled the oceans 100 million years ago - Phys.org,https://phys.org/news/2026-04-giant-octopuses-oceans-million-years.html
Unknown,broad_news,Other,"The incident is the latest eyebrow-raising bet on Polymarket, as allegations of rigging and manipulation continue to haunt the popular prediction market site.",Unknown,2026-04-25T10:59:02.929112+00:00,en,2026-04-23 22:22:38,https://npr.brightspotcdn.com/dims3/default/strip/false/crop/3799x2137+0+90/resize/1400/quality/85/format/jpeg/?url=http%3A%2F%2Fnpr-brightspot.s3.amazonaws.com%2Fe3%2Fe4%2F33ef19204c71b12671aa002d8114%2Fgettyimages-2270274138.jpg,NPR,NewsAPI,French police probe suspected weather device tampering after odd Polymarket bet - NPR,https://www.npr.org/2026/04/23/nx-s1-5797876/polymarket-paris-weather-bet
Ethan Millman,broad_news,Other,"Yes, Jaafar Jackson sings in the movie, but audiences also hear Michael Jackson throughout most of the musical numbers. Oscar-winning Music supervisor John Warhurst reveals how it all worked.",Unknown,2026-04-25T10:59:02.929112+00:00,en,2026-04-23 22:13:22,https://www.hollywoodreporter.com/wp-content/uploads/2026/04/001-mkt-001-cin-v0037-cnpt-1002-H-2026.jpg?w=1296&h=730&crop=1,Hollywood Reporter,NewsAPI,How ‘Michael’ Filmmakers Blended The King of Pop’s Singing Voice with Jaafar Jackson’s - The Hollywood Reporter,http://www.hollywoodreporter.com/music/film-tv-music-news/michael-jackson-jaafar-jackson-singing-1236573188/
Amber DaSilva,broad_news,Other,Nearly 400 horsepower ought to be enough to make the new Supersport 400 drive as good as it looks.,Unknown,2026-04-26T16:34:07.301144+00:00,en,2026-04-23 21:46:14,https://www.jalopnik.com/img/gallery/morgan-supersport-400-is-the-companys-most-powerful-vintage-look-roadster-yet/l-intro-1776980764.jpg,Jalopnik,NewsAPI,Morgan Supersport 400 Is The Company's Most Powerful Vintage-Look Roadster Yet - Jalopnik,https://www.jalopnik.com/2155923/morgan-supersport-400-most-powerful-roadster-reveal/
