author,category,country,description,domain,fetched_at,language,published_at,social_image,source_name,source_system,title,url
Michael Birnbaum,broad_news,Ukraine,"In a speech to Congress, the monarch avoided naming the president but highlighted democratic norms, Ukraine and Western unity.",Unknown,2026-04-30T08:30:51.323562+00:00,en,2026-04-29 05:49:03,https://www.washingtonpost.com/wp-apps/imrs.php?src=https://cloudfront-us-east-1.images.arcpublishing.com/wapo/CY5RGKXT6BBNCY4JFOAYU4NXSQ.jpg&w=1440,The Washington Post,NewsAPI,King Charles urges checks on executive power as Trump hosts royal visit - The Washington Post,https://www.washingtonpost.com/politics/2026/04/28/trump-king-charles-white-house-visit/
"Curtis Booker, KSL",broad_news,Other,A rabid bat found in southern Utah is prompting a warning from public health officials.,Unknown,2026-04-30T08:30:51.323562+00:00,en,2026-04-29 05:34:07,https://img.ksl.com/slc/2992/299267/29926702.jpg?filter=kslv2/responsive_story_lg,KSL.com,NewsAPI,Public warned after bat tests positive for rabies in southern Utah - KSL News,https://www.ksl.com/article/51490198/public-warned-after-bat-tests-positive-for-rabies-in-southern-utah
"Carolin Roth, Hugh Leask",broad_news,Other,"UBS reported its first quarter earnings on Wednesday, with net profits beating analyst estimates.",Unknown,2026-04-30T08:30:51.323562+00:00,en,2026-04-29 05:08:31,https://image.cnbcfm.com/api/v1/image/107211554-1679323065352-gettyimages-1248858788-AFP_33BP6XQ.jpeg?v=1745837813&w=1920&h=1080,CNBC,NewsAPI,UBS profits rocket 80% to $3 billion for first quarter beat - CNBC,https://www.cnbc.com/2026/04/29/ubs-swiss-bank-first-quarter-earnings-profit-switzerland-trading.html
"Avery Lotz, Josephine Walker",broad_news,Other,"The Justice Department tried to indict Comey last year for lying to Congress, but the case crumbled.",Unknown,2026-04-30T08:30:51.323562+00:00,en,2026-04-29 04:35:51,https://images.axios.com/hjNbBVypJXkpeZmQzuSTeyIo7Ag=/0x103:6000x3478/1366x768/2026/04/28/1777399701223.jpeg,Axios,NewsAPI,"James Comey indicted again, this time over ""86 47"" photo - Axios",https://www.axios.com/2026/04/28/trump-doj-indicts-james-comey
Joe Tipton,broad_news,Other,"Tyran Stokes, the No. 1 overall recruit in the 2026 class, has committed to Kansas and Bill Self, he announced.",Unknown,2026-04-30T08:30:51.323562+00:00,en,2026-04-29 04:16:08,https://on3static.com/uploads/dev/assets/cms/2026/04/28175354/Stokes-Kansas-AFI.png,On3.com,NewsAPI,No. 1 overall recruit Tyran Stokes commits to Kansas - On3,https://www.on3.com/rivals/news/no-1-overall-recruit-tyran-stokes-commits-to-kansas/
"Mohammed Tawfeeq, Max Saltman, Kit Maher, Kaanita Iyer, Dana Karni, Hira Humayun, Alison Main, Manu Raju, Morgan Rimmer, Mustafa Qadri, Nic Robertson, Mostafa Salem, Aileen Graef, David Goldman, Aida Karimi, Sana Noor Haq, Rupert Neate, Sarah Tamimi, Catherine Nicholls, Tim Lister, Eleni Giokos, Issy Ronald, Hanna Ziady, Chris Isidore, Matt Egan, Nadeen Ebrahim, Lex Harvey, Kevin Liptak",broad_news,Iran,"The United Arab Emirates will withdraw from the Organization of the Petroleum Exporting Countries (OPEC) this week, the UAE’s state news agency reports, as the Iran war roils global energy markets.",Unknown,2026-04-30T05:17:49.607548+00:00,en,2026-04-29 04:16:00,"https://media.cnn.com/api/v1/images/stellar/prod/gettyimages-958778608-20260428124300140.jpg?c=16x9&q=w_800,c_fill",CNN,NewsAPI,"Live updates: UAE to quit OPEC in blow to world’s leading oil exporters, as Iran war roils energy sector - CNN",https://www.cnn.com/2026/04/28/world/live-news/iran-war-trump-israel
Elizabeth Melimopoulos,broad_news,Other,The passports are part of broader plans to celebrate the milestone anniversary of the US Declaration of Independence.,Unknown,2026-04-30T08:30:51.323562+00:00,en,2026-04-29 03:29:35,https://www.aljazeera.com/wp-content/uploads/2026/04/2026-04-28T195632Z_864952272_RC2FYKAUOCH5_RTRMADP_3_USA-TRUMP-PASSPORT-1777423162.jpg?resize=1200%2C675,Al Jazeera English,NewsAPI,Trump to feature on limited-edition US passports for 250th anniversary - Al Jazeera,https://www.aljazeera.com/news/2026/4/29/trump-to-feature-on-limited-edition-us-passports-for-250th-anniversary
Jack Dunn,broad_news,Other,"Stephen Colbert said after an uneven first couple of months of 'The Late Show,' his producer encouraged him to lean back into his political roots.",Unknown,2026-04-30T08:30:51.323562+00:00,en,2026-04-29 02:45:00,https://variety.com/wp-content/uploads/2025/11/colbert.jpg?crop=0px%2C29px%2C1000px%2C562px&resize=1000%2C563,Variety,NewsAPI,Stephen Colbert Explains Why He Made 'The Late Show' More Political - Variety,https://variety.com/2026/tv/news/stephen-colbert-late-show-political-audience-wants-to-see-1236732906/
Joe  Walsh,broad_news,Other,"A federal judge on Tuesday dismissed a lawsuit from the Justice Department seeking information on Arizona voters, another defeat in the Trump administration's nationwide push for voter data.",Unknown,2026-04-30T08:30:51.323562+00:00,en,2026-04-29 02:32:45,https://assets2.cbsnewsstatic.com/hub/i/r/2022/08/02/66f1c095-ecf4-49db-a995-39ba93251a2a/thumbnail/1200x630/39fa93ec39d390bb7555b77adfd4c85b/hypatia-h_20330210084c64e7713dedceabb7ca55-h_8d03f26376e007480bb590032b09d511.jpg,CBS News,NewsAPI,Judge tosses out Trump administration lawsuit seeking access to Arizona voter data - CBS News,https://www.cbsnews.com/news/judge-tosses-trump-lawsuit-seeking-arizona-voter-data/
Alyssa Sybertz,broad_news,Other,"Experts share the best fruits to lower blood sugar if you're trying to avoid spikes, plus the simple trick that will help you keep your blood sugar steady.",Unknown,2026-04-30T05:17:49.607548+00:00,en,2026-04-29 02:13:13,https://s.yimg.com/ny/api/res/1.2/NaEuKhYT8jqZP5kFf6ggrw--/YXBwaWQ9aGlnaGxhbmRlcjt3PTEyMDA7aD02MDE-/https://media.zenfs.com/en/aol_prevention_182/ede2e8947a808381a5adb1c24a5abddf,Prevention.com,NewsAPI,Dietitians Say This Is the Number-1 Fruit to Eat for Stable Blood Sugar - AOL.com,https://www.prevention.com/food-nutrition/a71144048/fruits-to-lower-blood-sugar/
Meredith Jacobs,broad_news,Other,"Plus, what's ahead for RJ and Emi, should the series be renewed?",Unknown,2026-04-30T08:30:51.323562+00:00,en,2026-04-29 02:00:44,https://www.tvinsider.com/wp-content/uploads/2026/04/rj-decker-109-rj-1420x798.jpg,TVInsider,NewsAPI,‘R.J. Decker’ Boss Explains Shocking Death & Reveals Season 2 Details - TV Insider,https://www.tvinsider.com/1260896/rj-decker-victor-dead-season-2-details/
Lim Hui Jie,broad_news,Other,The first-quarter inflation figure was lower than the 4.2% expected by economists polled by Reuters.,Unknown,2026-04-30T05:17:49.607548+00:00,en,2026-04-29 01:54:00,https://image.cnbcfm.com/api/v1/image/108298831-1777426667087-gettyimages-2188478767-hpet2759_ynizj3e0.jpeg?v=1777426678&w=1920&h=1080,CNBC,NewsAPI,Australia reports lower-than-expected first-quarter inflation — but price rise highest in 2 years - CNBC,https://www.cnbc.com/2026/04/29/australia-inflation-q1-rba-rate-hike-outlook.html
Lisa Kailai Han,broad_news,Other,"On Tuesday, the S&P 500 and Nasdaq Composite slipped from the the records they notched a day earlier.",Unknown,2026-04-30T05:17:49.607548+00:00,en,2026-04-29 01:38:00,https://image.cnbcfm.com/api/v1/image/108297662-1777301356481-Traders-Photo-20260427-KK-PRESS-020.jpg?v=1777301438&w=1920&h=1080,CNBC,NewsAPI,S&P 500 futures are flat as Wall Street looks ahead to ‘Mag 7’ earnings and Fed decision: Live updates - CNBC,https://www.cnbc.com/2026/04/28/stock-market-today-live-updates.html
Amanda Gerut,broad_news,Other,The deepest tranche of options won’t fully pay off unless Meta becomes nearly twice the size of Nvidia.,Unknown,2026-04-30T08:30:51.323562+00:00,en,2026-04-29 01:38:00,"https://fortune.com/img-assets/wp-content/uploads/2026/04/GettyImages-2267997264_a36c60-e1777417380329.jpg?resize=1200,600",Fortune,NewsAPI,Meta is paying top executives to hit a $9.5 trillion valuation—and no one’s ever done it before - Fortune,https://fortune.com/2026/04/28/meta-q1-executive-stock-options-zuckerberg-9-trillion-valuation-moonshot/
Ben Schoon,broad_news,Other,"An early, limited leak around Google’s upcoming Pixel 11 series offers some limited details around the Tensor G6 chipset inside,...",Unknown,2026-04-30T05:17:49.607548+00:00,en,2026-04-29 01:25:00,https://i0.wp.com/9to5google.com/wp-content/uploads/sites/4/2025/08/pixel-10-repair-tensor-g5-1.jpg?resize=1200%2C628&quality=82&strip=all&ssl=1,9to5google.com,NewsAPI,Tensor G6 reportedly bringing latest ARM CPU cores but outdated GPU to Pixel 11 - 9to5Google,http://9to5google.com/2026/04/28/google-pixel-11-tensor-g6-cpu-gpu-leak/
Megan Morrone,broad_news,Other,Musk took the stand as the first witness in his billion dollar lawsuit against OpenAI on Tuesday.,Unknown,2026-04-30T08:30:51.323562+00:00,en,2026-04-29 01:19:21,https://images.axios.com/tnZFIqC66G6HTjihl_aY2NaQKDc=/1366x768/smart/2025/01/29/214751-1738187271876.jpg,Axios,NewsAPI,Elon gets his day in trial against OpenAI - Axios,https://www.axios.com/2026/04/28/elon-openai-altman-trial
WSJ,broad_news,Iran,No description,Unknown,2026-04-30T08:30:51.323562+00:00,en,2026-04-29 01:00:00,N/A,The Wall Street Journal,NewsAPI,Trump Tells Aides to Prepare for Extended Blockade of Iran - WSJ,https://www.wsj.com/world/middle-east/trump-tells-aides-to-prepare-for-extended-blockade-of-iran-da3be7a4
Lizzy Lawrence,broad_news,Other,Monitoring trials in real time may help shorten the time interval between trial phases.,Unknown,2026-04-30T05:17:49.607548+00:00,en,2026-04-29 00:57:05,https://www.statnews.com/wp-content/uploads/2026/04/GettyImages-2237911300-1024x576.jpg,STAT,NewsAPI,"FDA launches effort to speed up clinical trials, using AI - statnews.com",https://www.statnews.com/2026/04/28/fda-real-time-clinical-trials-pilot-project-astrazeneca-amgen-cancer-drugs/
Zack Geoghegan,broad_news,Other,The long wait is finally over. Five-star class of 2026 wing Tyran Stokes will play his college basketball at Kansas.,Unknown,2026-04-30T05:17:49.607548+00:00,en,2026-04-29 00:55:43,https://on3static.com/uploads/dev/assets/cms/2026/04/28151142/KSR-50-1.png,On3.com,NewsAPI,Top-ranked recruit Tyran Stokes commits to Kansas over Kentucky - On3,https://www.on3.com/teams/kentucky-wildcats/news/top-ranked-recruit-tyran-stokes-commits-kansas-over-kentucky/
Jon Wilner,broad_news,Other,"The NCAA is forcing expansion on the viewing public, because there's zero clamoring from the fans to increase the beloved basketball tournaments to 76 teams.",Unknown,2026-04-30T05:17:49.607548+00:00,en,2026-04-29 00:27:01,https://images.seattletimes.com/wp-content/uploads/2026/04/04282026_TZR_March_Madness-03172026-AP_tzr_162107.jpg?d=1200x630,The Seattle Times,NewsAPI,The outcome nobody wanted becomes reality: NCAA tournaments expand - The Seattle Times,https://www.seattletimes.com/sports/college-basketball/ncaa-tournaments-expand-as-the-outcome-nobody-wanted-becomes-reality/
The Associated Press,broad_news,Other,"Judges have rejected similar Justice Department efforts to obtain sensitive voter information in California, Massachusetts, Michigan, Oregon and Rhode Island.",Unknown,2026-04-30T05:17:49.607548+00:00,en,2026-04-29 00:23:00,"https://media-cldnry.s-nbcnews.com/image/upload/t_nbcnews-fp-1200-630,f_auto,q_auto:best/rockcms/2026-04/260428-elections-stickers-vsb-2014-35be98.jpg",NBC News,NewsAPI,Judge dismisses DOJ lawsuit against Arizona seeking voter data - NBC News,https://www.nbcnews.com/politics/justice-department/judge-dismisses-doj-lawsuit-seeking-arizona-voter-data-rcna342613
Jon Bitner,broad_news,Other,"More than a dozen digital Switch games are on sale at Amazon, including Metroid Dread and Bayonetta 3.",Unknown,2026-04-30T05:17:49.607548+00:00,en,2026-04-29 00:05:56,https://www.gamespot.com/a/uploads/screen_kubrick/1702/17023653/4689271-mixcollage-28-apr-2026-08-50-am-7086.jpg,GameSpot,NewsAPI,Save Up To 50% On Nintendo Switch Digital Games At Amazon - GameSpot,https://www.gamespot.com/articles/switch-digital-games-sale/1100-6539663/
John Hendel,broad_news,Other,The FCC's abrupt move to reconsider the licenses of eight ABC-owned television stations is the agency's first real effort to carry out a frequent threat of President Donald Trump.,Unknown,2026-04-30T05:17:49.607548+00:00,en,2026-04-28 23:50:05,https://www.politico.com/dims4/default/resize/1200/quality/90/format/jpg?url=https%3A%2F%2Fstatic.politico.com%2F3c%2F75%2F245f591f41e9bdeabad4b7308e8b%2Fmedia-trump-war-95784.jpg,Politico,NewsAPI,Brendan Carr takes on Disney — and escalates Trump’s media war - Politico,https://www.politico.com/news/2026/04/28/brendan-carr-takes-on-disney-and-escalates-trumps-media-war-00897612
Perry Stein,broad_news,United States,"The former FBI director shared a photo showing seashells arranged to write out “86 47,” which some saw as a call for violence against President Donald Trump.",Unknown,2026-04-30T05:17:49.607548+00:00,en,2026-04-28 23:49:39,https://www.washingtonpost.com/wp-apps/imrs.php?src=https://arc-anglerfish-washpost-prod-washpost.s3.amazonaws.com/public/ZL25FKCMPII6PGD4IKVVORO3FY_size-normalized.jpg&w=1440,The Washington Post,NewsAPI,James Comey indicted over 2025 social media post allegedly threatening Trump - The Washington Post,https://www.washingtonpost.com/national-security/2026/04/28/james-comey-indicted-second-time-by-justice-department/
Will Knight,broad_news,Other,"“Never talk about goblins, gremlins, raccoons, trolls, ogres, pigeons, or other animals or creatures unless it is absolutely and unambiguously relevant,” reads OpenAI’s coding agent instructions.",Unknown,2026-04-30T05:17:49.607548+00:00,en,2026-04-28 23:45:00,"https://media.wired.com/photos/69f144197df9442e8d9b4623/191:100/w_1280,c_limit/biz_gremlin_GettyImages-163004531.jpg",Wired,NewsAPI,OpenAI Really Wants Codex to Shut Up About Goblins - WIRED,https://www.wired.com/story/openai-really-wants-codex-to-shut-up-about-goblins/
Helene Braun,broad_news,Other,"While the trading platform’s crypto revenue tanked 47% to $134 million, a record-breaking surge in prediction market bets helped push overall revenue up 15% to $1.07 billion.",Unknown,2026-04-30T05:17:49.607548+00:00,en,2026-04-28 23:41:03,https://cdn.sanity.io/images/s3y3vcno/production/444f7a787b146a0e468e858e32f1f9d80f6c9c32-3600x2400.jpg?auto=format&w=960&h=540&crop=focalpoint&fit=clip&q=75&fm=jpg,CoinDesk,NewsAPI,Robinhood stock falls 8% after big earnings miss due to weak crypto trading revenue - CoinDesk,https://www.coindesk.com/markets/2026/04/28/robinhood-stock-shrugs-off-a-47-crash-in-crypto-revenue-thanks-to-a-massive-surge-in-event-betting
Marcia Dunn,broad_news,Other,"The spacecraft that flew four astronauts around the moon is back where its record-breaking journey began. NASA's Artemis II capsule returned to Florida's Kennedy Space Center on Tuesday afternoon, almost a month after blasting off on humanity's first lunar tr…",Unknown,2026-04-30T08:30:51.323562+00:00,en,2026-04-28 23:12:00,https://dims.apnews.com/dims4/default/e6bfc73/2147483647/strip/true/crop/7139x4757+133+0/resize/980x653!/quality/90/?url=https%3A%2F%2Fassets.apnews.com%2F3a%2F02%2Faf52c3d469ed79d58980dabcdbd5%2Fd3697c29f7c549d389bbeccfc4aa7f90,Associated Press,NewsAPI,NASA’s Artemis II moonship returns home to its launch site after historic voyage - AP News,https://apnews.com/article/nasa-artemis-moon-astronauts-64349e8a74939deb8e2f48e7c30a07cb
Anwesha Nag,broad_news,Other,"""Do chocolate mini eggs count?""",Unknown,2026-04-30T08:30:51.323562+00:00,en,2026-04-28 23:07:19,https://static.boredpanda.com/blog/wp-content/uploads/2026/04/fb_image_69f1364c1e245.png,Boredpanda.com,NewsAPI,Scientists Discover Life-Changing Side Effect Of Eating Eggs For Alzheimer Treatment - Bored Panda,https://www.boredpanda.com/eating-eggs-has-surprising-implications-for-alzheimers-risks-according-to-scientists/
Ed Cara,broad_news,Other,"Many scorpion species carry zinc and other heavy metals in their pincers and stingers, according to new research.",Unknown,2026-04-30T05:17:49.607548+00:00,en,2026-04-28 23:05:57,https://gizmodo.com/app/uploads/2026/04/stinger-1200x675.jpg,Gizmodo.com,NewsAPI,"Scorpions Are Literally Metal, Study Reveals - Gizmodo",https://gizmodo.com/scorpions-are-literally-metal-study-reveals-2000751750
Luke Plunkett,broad_news,Other,"'I've been in the industry for 20 years, and those of us who joined in the early 2000s, we had it very good'",Unknown,2026-04-30T05:17:49.607548+00:00,en,2026-04-28 22:46:25,https://storage.ghost.io/c/30/f5/30f5b1bb-84ee-4c26-b446-fb9a5e512994/content/images/size/w1200/2026/04/monument-valley-02.jpg,Aftermath.site,NewsAPI,'We've Been A Little Bit Too Romantic About The Idea That We Should Have Employees And Give People Long-term Job Security' Is An Extraordinary Thing For A Video Games CEO To Say On Record - Aftermath,https://aftermath.site/video-game-job-security/
Jill Goldsmith,broad_news,Other,"Quixote Studios is winding down operations in the Atlanta area, redeploying equipment and other assets to Los Angeles and New York.",Unknown,2026-04-30T08:30:51.323562+00:00,en,2026-04-28 22:46:00,https://deadline.com/wp-content/uploads/2022/09/Quxote-North-Valley-Exterior1.jpg?w=1024,Deadline,NewsAPI,"Quixote Studios Exiting Atlanta, Deploying Assets To New York & L.A. - Deadline",http://deadline.com/2026/04/quixote-studios-exiting-atlanta-to-focus-on-new-york-la-1236875233/
James Busby,broad_news,Other,"Hatsune Miku is officially getting her own fishing gear, because apparently even the virtual pop star needs her own tackle box.",Unknown,2026-04-30T05:17:49.607548+00:00,en,2026-04-28 22:17:34,https://www.dexerto.com/cdn-image/wp-content/uploads/2026/04/28/hatsune-miku-fishing-rod-collab.jpg,Dexerto,NewsAPI,Hatsune Miku gets glowing fishing rod and reel in wild new collab - Dexerto,https://www.dexerto.com/entertainment/hatsune-miku-gets-glowing-fishing-rod-and-reel-in-wild-new-collab-3357801/
"Tucker  Reals, Frank  Andrews",broad_news,Iran,Oil prices continue rising as the Trump administration unenthusiastically mulls an Iranian offer to reopen the Strait of Hormuz but delay nuclear talks.,Unknown,2026-04-30T05:17:49.607548+00:00,en,2026-04-28 22:17:00,https://assets1.cbsnewsstatic.com/hub/i/r/2026/04/28/48940ad9-5eeb-4ff5-ad69-e11130fce3fa/thumbnail/1200x630/90a43f5598aa5396c573ba96d383200c/us-blockade-strait-hormuz.jpg,CBS News,NewsAPI,Live Updates: Iran war and Strait of Hormuz stuck in limbo as Trump mulls latest Iranian offer - CBS News,https://www.cbsnews.com/live-updates/iran-war-trump-strait-of-hormuz-iranian-offer-ceasefire-oil-gas-prices/
Joey Schneider,broad_news,Other,"Six Flags St. Louis will reactivate a chaperone policy this weekend, requiring all guests 16 and under to be accompanied by an adult at least 21 years old.",Unknown,2026-04-30T05:17:49.607548+00:00,en,2026-04-28 22:09:25,https://fox2now.com/wp-content/uploads/sites/14/2026/04/AP03072204233.jpg?w=1280,KTVI Fox 2 St. Louis,NewsAPI,Six Flags St. Louis to reactivate chaperone policy this weekend - FOX 2,https://fox2now.com/news/missouri/six-flags-st-louis-to-reactivate-chaperone-policy-this-weekend/
Tim Reynolds,broad_news,Other,"The NBA has moved closer to a slightly expanded 16-team lottery, one that will flatten odds of winning the No. 1 pick and try to deter tanking by drastically lowering the chances of winning for the teams that finish with the three worst records. The proposal,…",Unknown,2026-04-30T08:30:51.323562+00:00,en,2026-04-28 22:08:00,https://dims.apnews.com/dims4/default/4fe72b9/2147483647/strip/true/crop/3344x2228+0+1/resize/980x653!/quality/90/?url=https%3A%2F%2Fassets.apnews.com%2F1b%2F8a%2F962a925e602d84627eca14e88895%2Ffb8750e7cb6d43f7aeb8df39f17597bc,Associated Press,NewsAPI,NBA moves closer to anti-tanking measures with drastic change to draft lottery odds - AP News,https://apnews.com/article/nba-lottery-proposal-tanking-c5a1b02f046b9a63f6aee5739934c2d4
Rebekah Valentine,broad_news,Other,Don't ban mii,Unknown,2026-04-30T05:17:49.607548+00:00,en,2026-04-28 22:05:23,https://kotaku.com/app/uploads/2026/04/tomodachilifereasonable.jpg,Kotaku,NewsAPI,Rupaul's Drag Race Subreddit Has Banned Tomodachi Life Posts - Kotaku,https://kotaku.com/rupauls-drag-race-subreddit-banned-tomodachi-life-2000691381
Unknown,broad_news,Other,No description,Unknown,2026-04-30T05:17:49.607548+00:00,en,2026-04-28 22:00:51,N/A,Spaceflight Now,NewsAPI,Live coverage: SpaceX seeks second attempt at Falcon Heavy launch following weather scrub on Monday - Spaceflight Now,https://spaceflightnow.com/2026/04/28/live-coverage-spacex-seeks-second-attempt-at-falcon-heavy-launch-following-weather-scrub-on-monday/
Drew Lerner,broad_news,Other,Disney reportedly will not spin off ESPN amid rumors that new CEO Josh D'Amaro could choose to let go of the company.,Unknown,2026-04-30T05:17:49.607548+00:00,en,2026-04-28 21:59:36,https://cdn1.thecomeback.com/wp-content/uploads/sites/94/2026/01/20180322_MR2_1350.JPG-1200x1200-1-e1767916930212.jpg,Awful Announcing,NewsAPI,"Disney will not spin off ESPN, per report - Awful Announcing",https://awfulannouncing.com/disney/will-not-spin-off-espn.html
Jasper Goodman,broad_news,Other,The former Massachusetts lawmaker says progressives in his party have “embraced an agenda that goes beyond what’s politically acceptable.”,Unknown,2026-04-30T05:17:49.607548+00:00,en,2026-04-28 21:54:28,https://www.politico.com/dims4/default/resize/1200/quality/90/format/jpg?url=https%3A%2F%2Fstatic.politico.com%2F52%2Fe0%2Fa90bbe1e4d4aa1a0a93ab8c6bc9c%2Fhttps-delivery-gettyimages.com%2Fdownloads%2F2247380683,Politico,NewsAPI,"Barney Frank, entering hospice care, embarks on a final act: Taking on the left - Politico",https://www.politico.com/news/2026/04/28/barney-frank-hospice-democrats-00897112
Barbara Ortutay,broad_news,Other,"Elon Musk, the Tesla CEO, world’s richest man and OpenAI’s cofounder, took the stand Tuesday in a high-stakes trial revolving around a bitter feud between himself and former friends Sam Altman and Greg Brockman that could reshape the future development of art…",Unknown,2026-04-30T05:17:49.607548+00:00,en,2026-04-28 21:43:00,https://dims.apnews.com/dims4/default/016b7ff/2147483647/strip/true/crop/3756x2503+0+1/resize/980x653!/quality/90/?url=https%3A%2F%2Fassets.apnews.com%2F56%2F1e%2Fd9f9422e7af87f112123e2532fa3%2F64ede997efa7434086cfb296c38056b0,Associated Press,NewsAPI,Elon Musk takes stand in trial vs. Sam Altman that could reshape AI’s future - AP News,https://apnews.com/article/elon-musk-openai-altman-trial-b3c647391fbaa0f081611027b4e98479
Cailey Petsch,broad_news,Other,The 44-year-old father is warning others about the dangers of taking weight-loss jabs without medical supervision.,Unknown,2026-04-30T05:17:49.607548+00:00,en,2026-04-28 21:21:44,https://media.thedailybeast.com/resizer/v2/I3YKYZ5ONRD7TNSQGI7LP5DRGE.jpg?auth=d3ebc6ca82c7e30ed2c669007dc9090eca942c6453a4263088c6b8a78c4d21fe&width=1200&height=630&smart=true,Daily Beast,NewsAPI,Man’s GLP-1 Horror Story Leads to Organ Removal - The Daily Beast,https://thelooker.thedailybeast.com/mans-glp-1-horror-story-leads-to-organ-removal/
"Adam Clark, Kit Norton",broad_news,Other,"Nvidia stock, Advanced Micro Devices and Broadcom were all dropping amid worries about the sustainability of OpenAI's spending.",Unknown,2026-04-30T08:30:51.323562+00:00,en,2026-04-28 21:12:00,https://images.barrons.com/im-22122010/social,Barron's,NewsAPI,Nvidia Stock Drops. Why Chip Stocks Keep Getting Hit. - Barron's,https://www.barrons.com/articles/nvidia-stock-price-chip-selloff-openai-60e71726
Unknown,broad_news,Other,"An attempted shooting at the White House Correspondents Dinner on Saturday has, again, highlighted the climate of political violence in the U.S. But there are still many questions about the motive.",Unknown,2026-04-30T05:17:49.607548+00:00,en,2026-04-28 21:05:31,https://npr.brightspotcdn.com/dims3/default/strip/false/crop/5000x2813+0+260/resize/1400/quality/85/format/jpeg/?url=http%3A%2F%2Fnpr-brightspot.s3.amazonaws.com%2F54%2F74%2F025712894d96933775b49f45047a%2Fgettyimages-2272612765.jpg,NPR,NewsAPI,"With no radical footprint, what drove suspect to try and assassinate Trump? - NPR",https://www.npr.org/2026/04/28/nx-s1-5801467/cole-allen-suspect-washington-correspondents-dinner-shooting
Jacqueline Thomas,broad_news,Other,No description,Unknown,2026-04-30T08:30:51.323562+00:00,en,2026-04-28 21:00:38,https://assets-prd.ignimgs.com/2026/04/28/dawnwalkerthumb-1777393909756.png?width=1280&format=jpg&auto=webp&quality=80,IGN,NewsAPI,"Want to Max Out The Blood of Dawnwalker at 4K on PC? It'll Cost You at Least $3,000 - IGN",https://www.ign.com/articles/the-blood-of-dawnwalker-specs-rtx-5090-4k-max-setting
Keith Cooper,broad_news,Other,"""The extent of the Milky Way's star-forming disk has long been an open question in galactic archaeology.""",Unknown,2026-04-30T08:30:51.323562+00:00,en,2026-04-28 21:00:00,https://cdn.mos.cms.futurecdn.net/Fzc9DxhUzqz8zi54YDqYve-1920-80.jpg,Space.com,NewsAPI,"Starbirth shuts down 40,000 light-years from the Milky Way's core — and astronomers don't know why - Space",https://www.space.com/astronomy/stars/starbirth-shuts-down-40-000-light-years-from-the-milky-ways-core-and-astronomers-dont-know-why
"Aaron Mak, Dana Nickel, John Sakellariadis",broad_news,Other,"National Cyber Director Sean Cairncross is expected to chair the discussion, which will also focus broadly on cybersecurity and AI-related topics.",Unknown,2026-04-30T05:17:49.607548+00:00,en,2026-04-28 20:59:08,https://www.politico.com/dims4/default/resize/1200/quality/90/format/jpg?url=https%3A%2F%2Fstatic.politico.com%2F4b%2F6a%2F3efb515f4f42858a76f2653012e0%2Ftrump-88-7.jpg,Politico,NewsAPI,White House huddles with tech firms as Mythos raises cyber stakes - Politico,https://www.politico.com/news/2026/04/28/white-house-huddle-cyber-mythos-00896589
